msgID,texte
1251,"The assumption most likely relates to (1) the risks faced by the companies being compared and (2) whether the company is fairly valued by the market 
 I would be wary of using this method in bubbles like the 90's tech book, when almost every company was overvalued by the market 
 Moreover, negative earnings would result in negative P/E ratios, which would not be a good indicator of the company's true value"
8656,"If I’m a conservative investor I should have a large part of my portfolio in gold, but as a moderate as I am, I would have just a small portion in god"
259,"I think it depends on the real composition of our portfolio assets 
 Ist our portfolio homogeneous or not, i.e ist all or the major part of assets are riskful oder all or the major part of assets are riskless 
 Though the compositio of portfolio plays a great role in the decision of amount of gold to buy, there is a minimum quantity of gold that should always be keeped in the portfolio against sudden events that can't be predicted 
 So i agree with the fact to have relatively small part of gold to stomach the impact that extreme events may have on traditional assets"
1475,"If the company reported a loss, then the P/E ratio will not be available 
 Thus we may need to find some other ratios for valuation purpose 
 Also, sometimes it's difficult or nearly impossible to find any company that's similar to that to be valued 
 For example, Alphabet Inc, which is the parent company of Google Inc. It looks like there is no similar companies that could be used to evaluate the price 
 Google's income comes from online ads (more than 80%) which is on its search engine and YouTube videos 
 Another tech giant in online ads industry is Facebook 
 However, Facebook is about social network instead of web searching 
 This makes a total different company culture and decision making for these two companies 
 At the same tech area, Amazon has P/E ratio of more than 180, while Alphabet only has 30s. Even if they are in the same industry, they could be very different"
1739,"To use a singular valuation method would lend itself to error by not looking at the larger framework 
 It is always best to assess any dynamic situation or circumstance from different perspectives to fully understand"
4157,"The US government bailout of its financial sector was a necessity to avoid a catastrophic collapse of the economy which would have cause extensive damage to the world economy 
 Whether the problem has only be deferred until the next crisis remain to be seen"
4202,I would have just a small part of my portfolio invested in gold as an insurance
7365,Assumptions: (1) The companies are in the same/similar stage of growth and have comparable capital structures (2) Using  multiple-based valuation during a bull run or a bubble build-up could be inappropriate
8267,"Hi 
 Any one help me for the Quiz 2 questions 2-3-5-7 I am not understand the calculation 
 Please give me the  hand to solve the questions."
5801,"The assumption is a similar capital structure for the comparable companies 
 During periods of recession you should not use P/E because the companies will probably reduce their E in the future 
 If the negative earning was caused by an specific problem on that year, we can still use P/E taking the average E from, say, 10 last years"
3465,"On one hand I believe some help to the financial sector was necessary, however I believe decisions have been made in a very unsteady environment and have been rushed, without prior consideration of other simultaneous interventions 
 Some sort of increased regulations should have been put in place at the same time and as a condition for the bail out, like the re-institution of a form of Glass-Seagall Act with the separation of commercial and investment branches of banks (maybe the one thing Trump might indeed get right. 
 ), etc. 
   In Europe, lowering interest rates without prior consideration of some regulations to enforce lending has ended up in free money for the banks and no impact on economic growth, blowing a dangerous situation of huge amounts of money ready to flood the market, with potentially heavy effects on future inflation"
767,I would have a small part of my portfolio invested in gold as a hedge and down side protection in case of a black swan kind of event
745,"It is necessary that governments provide a framework for companies and civil society within which they set clear rules on how to behave 
 The government has the responsiblity to create this framework within its country and make sure all actors comply with it 
 The subprime crisis showed that the government did not provide a framework which protected consumers and other companies from reckless actors on the market 
 The Troubled Asset Relief Program was therefore an important measure to prevent the Americans from the worst 
 But the actual task of the government was then to develop a framework which would not allow again for such a crisis 
 In the following years, banks had to take responsibility for their actions and as a result, have to operate now within a much stricter regulatory framework"
6503,"Actually it depends on your risk appetite and gold as anchor could be used  to balance average risk of your portfolio 
 E.g 
 A lii;e part of gold with big part of investments in bonds and equities of developed markets , and vice versa for emerging markets"
7382,"Hi Jaden 
 The .08 is WACC - gFCF from the formula, so 12% minus 4% Weighted cost of capital (WACC)= 12% and growth from 2020 and beyond is stated above at 4% 
   I hope this helps 
 _smiley_"
4389,"Bailout probably was necessary but later on appropriate steps should be taken that will not happen again 
 Good example here is one of European countries and what they done with their 'banksters'"
2499,"Assuming that there is no other macro, political risk"
1264,"I think it was necessary 
 In Europe QE has gone hand in hand with an increase in banking regulation to ensure the financial crisis is less likely to be repeated, which seems prudent 
 In the US, however, after an initial burst of activity (Volker etc) the reforms seem to have slowed, which potentially increases the danger of a repeat"
2697,I think is necessary help the Banks which have a difficult situation by capital point of view
8070,"Maybe having about 5 to 10% of gold in our portfolio could be a good solution against extreme events, and can allow us to be less anxious about these kinds of risks"
4703,"I think the intervention was probably necessary but banks, especially now that they have seen that they will be bailed out, should be held more responsible and should be screened for irresponsible behaviour and kept an eye on so that the government knows what they are really doing to avoid another sub prime mortgage crisis"
6225,"Hi 
 I am just another student, but I suggest you try using a different browser such as Google Chrome or Internet Explorer"
3300,"Initial view was that the government bailout of the major US banks was akin to ignoring or even rewarding banks which over-leveraged assets and even sold some toxic ones on unsuspecting customers 
 In retrospect, much of the US financial stability was tied to these banks, and penalizing them severely could have potentially tail-spinned the US into another Depression 
 So, the bailout was inevitable to ensure US would continue to function as we know it"
6646,10% Gold
2022,"Are you Dave from Financial markets , Yale University"
6852,"Hi Ronald Thank you for posting such an interesting and thought provoking post 
 It is a way to look at it, however risk/return trade off is usually viewed in terms of the size of the risk versus the return, it depends on the investors levels of risk tolerance or risk aversion 
 For those that are risk shy, the amount of return is not their primary motivation, they are more interested in the levels of risk 
 Their ultimate question is how safe will my money be 
 Inversely those that have risk tolerance tend to focus on the levels of return first then risk later, that is what it is called a trade off. there is not ""right"" pick for everyone, it depends on your focus, goals, age etc"
1243,"I agree with most others that the introduction is too long 
 I would rather watch shorter videos as part of an introduction 
 I don't like the fact that the concepts went from very basic to more elaborate, complex topics then came back to the basic concepts again 
 I will leave a more detailed review shortly"
1330,"I think the bailout was necessary, but at the same time, it is very likely to give a bad incentive for banks, with a lot of fraud cases in the financial sphere surfacing even post-crisis"
4337,"Considering the magnitude of the 2008 financial crisis, the US government's decision to bailout its financial sector could be said to be a necessary step to recover the economy 
 However, the government's action did provide potential for future moral hazards of banks as they can always expect some form of governmental bailout for reckless behaviors"
2561,"Normally, I'd keep a rather small portion of my portfolio in gold; however, as global politics become more tumultuous, it would probably be smart to keep a higher portion of my portfolio in gold"
6327,"When we use ratios we observe on the market to value other comparable companies we assume that a true comparison between companies can be established and that differences can be adjusted in an objective manner 
 Also, we assume that the market values an entire industry properly, which could lead to errors if the latter is over/undervalued 
 In this sense, the  _domain_  bubble in the late 1990s/early 2000s is a good example of a market valuation of a sector gone wrong, with investors buying stock of overvalued IT companies because they belonged to a presumed high growth industry 
 Using multiple-based valuation methods to value companies in this case may not have given the best results"
8091,"Hi, I think Prof 
 Girardin is not quite accurate when he states in lecture 4.1.1 that  the primary goal of the Reserve Bank of Australia is ""Maintaining the integrity and value of the currency"" 
   From the RBA website; ""Its (the RBA's) duty is to contribute to the stability of the currency, full employment, and the economic prosperity and welfare of the Australian people 
 It does this by setting the cash rate to meet an agreed medium-term inflation target, working to maintain a strong financial system and efficient payments system, and issuing the nation's banknotes.""  The RBA's inflation target is between 2-3% and we have just had cash rates drop to 1.75% as inflation has dropped below 2% 
  By my understanding this should ( 
 ) lead to a reduction in the relative value of the currency"
4155,I would probably allocate around 15% of my portfolio in gold for insurance
6051,"Maybe the government can purchase the troubled assets with a condition of selling it back 
 Or getting some kind of assurance from banks that they will be more carefull next time"
8798,A relatively small part
280,"In so called ""low interest rate policy"" of CB (government), there is no direct impact on banks behavior 
 Loan loss provision is stable trought growth phase and increasing in depression, so no policy/law/direction 
 Can force banks to provide riskier loans just following the higher profits"
7157,"Hi Miguel, Thanks a lot. I've already completed this module 
 If you can please attach all the slides to the post I've mentioned in my original thread.\n"
7105,"Hi, THANKS  i THINK IT WAS A TECHNICAL ISSUE , BECAUSE AFTER WHILE , I RETOOK THE ASSESSMENT WITH THE SAME ANSWERS PREVIOUSLY CONSIDERED WRONG AND I PASSED 
 \n"
5019,"The assumption would be that the value of debt between the companies in the same sector is comparable, their credit rating is comparable (they can borrow money at the same interest rate) , their risk taking is similar 
 Examples of unsuitability of using P/E ratios are like today in the oil market, the P/E ratio is not representative of the companies' potential of investment (even more many companies during this turmoil  are reporting losses and the P/E ratio is N/A)"
7911,"My instructor said that discounting could be considered as flexible as you wanted 
 For example, you may consider this as the amount of money you want to receive in the future when putting your money in a bank, so the discount rate here can be the interest rate that your bank offers 
 Or you can use your expected return rate as discount rate 
 For example, you want to invest $100 today and want to receive $110 next month, so the return rate would be 10%"
8100,"Same here, my ans for ques no 2 is 6047 but it is incorrect  
  can anyone help in getting right ans"
3370,"Assumption is that other comparable listed companies are not under/overvalued 
 This is a dangerous thinking as it does not take into consideration the reality of the market 
 In history, I would refer to any precedent ''bubble'' crisis such as the dot com crisis, and imagine that back in time, I would not have felt comfortable facing multiple based valuation methods as all  _domain_  companies seemed to be overvalued and signs of speculation were strong 
 In regards to companies that reported a loss, it does not mean they are not good to invest in, we must look at the future and the growth potential on micro and macro levels"
8789,Small amount
3394,"I believe that this would depend on your own risk preferences and stage of life 
 A younger, less risk-averse investor may hold a lower amount in their portfolio versus an older investor holding a higher amount to secure real wealth levels"
5355,"Each method to prove is very difficult to prove in real life 
 It can give a estimate to the correct p/e ratio 
 Also the to find the fair value of a stock; you need to understand the sector and industry and their numbers ratio ; to see if the company that you are studying has the same p/e and have the same cost structure 
 Also has to see the sales - cost = profit - to see if the are in sync with the peers"
7199,"Hello, I don't see a link to the lecture slides 
 Are they provided, and I'm just not seeing the location, or won't we be getting them 
 It would be great to have them as a reference for formulas and other information 
 Thanks, Elizabeth"
8269,Around 5% to my potfolio
1030,Assumption that earnings are predictable for the future
176,"Price to earning ratios and other types of valuations do not take into consideration growth in the coming quarters or years to come 
 They also do not take into consideration the discounted value 
 It is very focused on the present therefore hard to track what the valuation would be in the years to come, whether it is in a downward or upward trend"
5319,"We assume that they have the same debt 
 Comparing Toyota to GM during the financial crisis would be a bad instance using multiple-based valuation"
205,It may have been necessary but it's unclear if there were any long-term benefits to this approach
2383,"Companies in turn-around situations are difficult to evaluate 
 Also, as past does not predict future performance, particularly systemic crises such as the World Financial Crisis would not allow for use of multiple-based evaluations"
1198,"That is true, however it also depends on the set- up of a particular market, BSE which is the stock market in my country doesn't have that provision 
 Re-investment has to be done physically by investor as dividends can only be given out in investors name 
 But i understand what you mean"
4306,"If I am an American, I will feel worry about the consequences 
 For example, we can see big insurance company sells very high rate money insurance nowadays 
 People all know, even crisis come, government will ensure the insurance company"
2524,"I would have a Small portion, 10 % in Gold for insurance reasons"
1097,"I believe that the raised question can have more alternatives than the two presented 
 Over my perspective the “bailout” alone is reckless; however it is an clever approach when additional actions take place 
 By implementing programs as the ""TARP"" (Troubled Asset Relief Program), the government indeed creates an careless environment; however such actions can be accompanied by the creation and reinforcement of policies/regulations leading to ensure an secure and stable environment 
 Therefore, the current situation can be ameliorated as well as the reoccurrences risk can be mitigated"
7154,"Hello, In this video, divides it up into 4 quadrants, perfection, warming, too hot, cooling, and too cold 
 He says that cooling and too cold are the worst, because it is deflation 
 But on the chart where it shows real returns, cooling is actually second best to the perfection category, meaning this is the 2nd best scenario 
 So maybe does this mean that cooling is ok, as long as its not too far into that quadrant, like a little bit of 'low inflation' and a little bit of 'low gdp growth' but not so much as to cause a deflation or to get 'too cold' 
  Thanks"
5907,"I am a risk averse investor, so I would prefer having a large part of the portfolio in gold even if that means loss of extra income"
5969,"Would put relatively small part of portfolio in gold and get the higher return from other assets 
 This is due to my preference for higher risk therefore reward"
181,"Bailout was indeed necessary 
 Proper enhanced tools being placed after the crisis should help prevent similar meltdown"
7758,"What about the currency risk that Michelle tell us in ""Investment Management in a nutshell 1"" (min 4.:22) 
   I think that the currency is important, not just the return 
 If is not, the best stock market in the world in 2015 was Caracas (Venezuela):   313,8% 
        Saludos"
4471,It would depend on market conditions
511,"Hello everyone 
 We are establishing an international network of contacts to improve employability in the field of finance 
 We know the importance of contacts in finance 
 Join us for further information:"
5889,"Compared to European choices,  us policies has been the right answer to the crisis , but this of course could trigger new booble and moral hazard behavior 
 The economy it is not an exact science and history would never be the same 
 Finally, usa as a financial culture more focused on the opportunity than on the riskies, the future is uncertain in both case"
850,"The US government should not give an incentive (bailout) to its financial sector upon their failure to follow rules and regulations, in fact they should penalize them for not abiding by the rules"
2150,"In my opinion, I would devote 10% of my portfolio to gold, in order to have some kind of insurance but without taking away the ability to invest"
3606,"Hello everyone 
 We are establishing an international network of contacts to improve employability in the field of finance 
 We know the importance of contacts in finance 
 Join us for further information:"
8428,Relatively small part
1476,"I rather invest a small part in Gold and the big part of my portfolio in other investment 
 As an insurance, we can also uses Fixed Asset instead of Gold; and for return, I prefer the stock with moderate percentage growth"
4507,"I think it is better to have gold as a small percentage of ones portfolio so that in times of inflation the gold can be some form of hedge 
 Investing heavily is gold does not sound like a good idea to me in the sense that the opportunity cost is quite high 
 One could invest in other asset classes like stocks and have a higher return over a couple of years 
 Gold seems to be very relevant when the economy is going bad or people presume that the economy will go bad soon 
 Investing heavily in gold during bull markets does not sound that appetizing to me"
7349,"I really loved how the distinction between the equilibrium of all present values of cash flows, namely Duration, and the time until you receive the principal, Maturity was made in such clear graphic representation 
 I have to say that the camerawomen distracted me a little bit, but I still grasped the concept 
 _smiley_"
7362,"Gilberto We need to answer Q1 despite being a bit funny, or maybe odd.\n Q5 - You're right , it's not necessary to use the NPV formula 
 However using the concept of NPV you can get to the right answer.\n Q7 - There is a common practice in the stock market relative to considering or not the debt when using some ratios, and I think that the Instructors are taking that in consideration 
 In the lectures you can see if we should take debt in consideration or not. Said that, I agree that there is opportunity to improve this question 
 We also have to consider the limitation of P/E valuations"
8121,"If i were an investor I'd consider two moments: 1 
 The market where I'm going to invest money which brings us to the RISK notion 
 2 
 Time period 
 Assuming I'm trading on emerging markets I'd use 40/60 proportion: 40% in gold, 60% - in other financial instruments (bonds, stocks etc) 
  It makes sense because of high risk and volatility 
 In case of developed markets it's possible to apply 30/70 or even 20/80 share taking into consideration the low chances of unlikely events and lower risks"
22,I would rather have 50% in gold
6995,Thanks a lot
3678,"I would rather keep a small percentage as a hedge against black swan events and market downturns 
 Investing in gold also has management fees and zero yield in additional to lost opportunity cost"
137,"The assumption would be that the P/E is reflecting the company, however, the stock could be over or undervalued 
 As a result, the P/E would not be a good indicators and will drive to false interpretations 
 In addition, 3 others factors need to be taken in consideration: regulations, macroeconomy, and technical"
3857,"The assumption with using ratios/ multiples is that a company is priced fairly 
 Also, comparable firms might have different environmental and industry/company specific factors which need to be looked into, where these ratios fail to provide the right way of assessing the fair value 
 A lot of variables tend to get overlooked through just looking at these ratios"
5965,"I could agree to some extent with your view, but I would like to point out two ideas: First is that, in that case, there should exist no Federal Deposit Insurance 
 Since this could have implied a lot of bankruptcies and bank liquidations, a huge amount of people, professional investors, and companies would have lost all their money 
 It goes against economy development and against trust that support all the financial system 
 My second point is that the financial sector is not another sector, but it is, in my opinion, like the arteries and the veins of the economy, since this sector conducts the blood (money supply) through the entire system 
 Therefore, I think that some special care have to be done to this vital function in the economy 
 However, I agree with the idea that responsibilities should be asked for somehow, so the public money would not be free for the banks"
126,"I believe that government action made necessary, because if the government does not help the banks, something worse could happen, I confess that I have some doubts whether the government should or should not interfere ever, Keynes vs Hayek, will study more to have an opinion accurate"
1162,"Well I suppose it would depend on the prevailing economic and investments conditions 
 As we have seen, Gold can indeed be used as a hedge against various adverse effects 
 But I would also consider the opportunity cost of holding gold as I would not want to hold a portion of my portfolio inn gold that could be making returns elsewhere 
 So I don't think there is a straightforward answer the question 
 I believe it depends on the prevailing economic and investment environment"
6152,"The DCF method provides us with an useful way of implementing stock price assumptions when it requires a long-time forecasting, multiples-baesd valuation, however, just considers the P/E ratio stays constant"
799,That all comparable companies have the same expected return (perceived risk) and the same growth rate in dividends (or earnings/cash flows assuming all is paid out)
7450,50% or less.\n
317,"20 percent of the tital portfolio should be in gold 
 Because in case of an ullikely black swan event in comparison the 20% portofolio in gold will have more purchasing power due to hyper increase in demand for gold"
2593,"At this moment I haven't invested in Gold, because I would like to invest in it when the prices of gold are lower 
 However, after having go through this chapter I might consider investing like 10/15 percent in gold to start with"
1061,"This depends on your investing goals and short-term focus verses long-term desires 
 Holding gold within your portfolio minimizes risk but can cause a decrease in potential returns 
 This is ideal for individuals that are holding gold for retirement or in the later years 
 On the other hand, millennials should limit gold assets in order to increase liquid returns and can take on more risk due to their investing lifespan being larger than average"
5634,You make assumptions on a similar capital structure and risk factors
8440,"I plan to invest for the long term, so only a small part of capital will be invested in gold"
4926,"I believe that the decision the US government took was an incredible way for the country to recover 
 Today the results are visibles: the country is doing well and recover much faster than any other country 
 On the other hand, if banks are driven by people that only look at profit and not at the well being of the economy, they could reproduce what happen ealier (thinking that the government will again bailout the financial sector and especially banks' statement) and as a result the economy would crash 
 I do not think the US government could again bailout the financial sector, so consequences would be desastreus for the world economy."
