msgID,texte
2760,"Hi, I am a business analyst procurement in the FMCG business"
6892,"I think the governments are one of the agents in the market 
 Their actions are very important for all. They can help the economy to go up or to slow down when there is a real risk of over inflation 
 But I do not think that their actions can be bad incentives 
 When they take a decision, this decision is the same for all the competitors 
 So the ones that are in better conditions can take more advantage that the others 
 So, at the end, It is not a reward for those that are not doing their things in a proper way. For this I do not think It can be considered as a bad incentive"
1235,"The current value of the comparable company must corredpondent to its fair value meaning it mustn‘t be over or underrated 
 The  _domain_  Crisis was a good Example where there was a tech bubble and pretty much all tech firms were highly overrated 
 If a Company just reported a loss the P/E ratio can not be calculated or better: it is not comparable anymore, since it‘s negative"
8743,A small part
5877,"Please read the works of Milton Friedman for a lucid explanation of the necessity of free markets for free, democratic nations"
5195,"There are so many variables that influence the value of a company in reality 
 If a company is compared with another just due to the segment they have in common, there could be many important things left behind that can have a much bigger impact on its valuation 
 The company that is taken as a benchmark can be leveraged for instance, or can be involved in some scandal or ilegal activity, can a have a complete different culture and capital structure 
 Also, the market is prone to price the stocks according to its expectations, not just about the future of the companies particularly, but also about the economy, what can change very fast"
8883,Keep a small part
2979,Large amount of gold in times of uncertainty
4883,"Capital structures differ, and accounting earnings methodologies differ among companies, especially when so man y one time write offs occur 
 Also, market cap differences can have a meaningful effect"
1584,"Ratios do not show the whole picture of a company 
 As an example it does not show the debt 
 It just shows the earnings vrs what the market consider is the value of the company equity"
3595,"The crisis would have been much worse without the TARP 
 Some sectors (investment banks for example) were not seen as banks and had limited supervision 
 While the sector cannot ""feel"" it will be always helped, TARP seems to has been fundamental in the rescue process 
 Regulation, macroprudential measures, governance, transparent information, audits, stress tests and other instruments need to be used to keep the sector healthy"
5179,My opinion bailout was needed in line with more severe requirements for the future limitations to loans granting
6149,Offer not offered
4716,"Assumptions using multiple based valuation are followings: 1 
 One can properly define comparable companies 
 2 
 Comparable companies have similar risk and growth profile 
 For example, PER can be stated by different way i.e 
 PER = 1 / (equity cost of capital - growth rate) 
  So, using average multiple of comparable companies means that comparable companies have similar equity cost i.e 
 Risk profile and growth rate 
 3 
 Share price converges to the average multiple of comparable companies 
 Etc. We can encounter the situation in which those assumptions cannot be appropriate 
 In the case when companies reported a loss, I tried to calculate normal earning power of evaluated companies (the company who creates loss forever cannot be sustainable as going concern, so normal earning excluding temporary setback can be positive), but such way also includes many assumption similar to DCF. In the short, all valuation including DCF and multiples is based on many assumptions about uncertain future 
 So, I think that valuation is not science but some sort of art or just tool for explanation to others"
3153,As turmoil in financial markets increased and equity markets are overvalued  a gold percentage of at least 30% in portfolio is fine
7920,"Hello Brian, Can you help me with the outcome of questions 3 and 5 of the second week Quiz, please 
 I have difficulties to solve them 
 Thank you. Rafael Tárrega"
8943,"I think this was a necessary action that will call for further insight and in my opinion, a wall street tax to pay back the cost of these bail-outs 
 (it can be small and gradual over time, but something to not completely remove lenders from fault)"
789,"I think I would not hold more than 5% - 10% of gold in my portfolio because macroeconomic cycles (historically) demonstrate that out of 4 cycles three consist of market expansion, while just one consists of recession 
 So, I would not support for long a higher cost opportunity for holding too much gold in my portfolio"
2210,"I find the information given in the video lectures is very different from that required to answer the questions 
 The lectures are more about theory and the big picture 
 I almost feel like I have missed a lecture or two"
7922,"What I understand from this video is , they are comparing Index with PE  
  In 2004, in P/E ratio  P is comparatively higher than E(say P increase from 100 to 110 and E increases just from 50 to 60   ) so as a value to investor it was not much more but price that Investor has to pay for stock is higher(Final P/E in 2004 = 110/60) 
  In 2007 , (P/E) ratio Price increases (say from 100 to 110) but Earnings of company increases more (say from 50 to 100) so ratio of P/E decreases compare to 2004 and Investor gets more values as he has more claim on company resources, compare to 2004(Final P/E value 110/100)  
  In nutshell, Basically it is to differentiate between price you are paying and value you are getting by that  
 In 2004 Price is more but value it generate is less compare to 2007 
 It will be easy to imagine if we see it in terms of mathematical expression!"
80,"Hi Jonas, I would like to chime in 
 The glossaries that are linked are quite extensive 
 Right now I am writing down terminology from the videos and then looking those words up in the glossaries; however it would be lovely if those were pre-linked to the modules so we dont have to search through the glossary 
 Not critical, but helpful"
1067,"Realizing that gold yields 9% annual return, I would invest upto 40% in gold 
 Thanks"
168,A small amount but I would vary it based on whatever solid information I can have access to that would help me assess or predict general volatility of my other investments or to assess political or economic risks
8432,Relatively small part
2807,"The assumption is that the stocks trade at a fair market price 
 In the dot-com bubble it would not have been a good valuation method"
2631,Media is good but if you can read the indexes is much better to do a background research
6169,"Hello I am Lucy from India and have also completed the course 
 All the best to everyone with the course"
6670,Ηι mohamed I hope to join the course
5718,"When we use ratios to comparable companies , we assume the management  and internal culture of each company is similar, but could be very different and it's performance very different in the future 
 In the past I don't know about the feeling about this method using multiples , but could be true the bad sensation, because the market needs good and realistic information to be confortable"
6885,"The bail outs were necessary to avoid an even deeper crisis 
 The economy needed to recover and by removing these bad assets it allowed the banks to be less afraid of lending, which is the case in Europe 
 Where even though they are getting cheap money, they were reluctant to lend"
8746,I will go for small part of my protfolio to hedge for other investments
8375,Small
7150,"Hi, does anyone have the answer to question 5 in the quiz - would like to see where I went wrong  
   Thanks  A-M"
6679,"If an investor chooses to own gold, it should be thought of as part of a diversified portfolio and not as ""insurance"" against loss 
 Owning 10-30% gold is not going to protect you against losses 
 Small allocations of gold did not ""protect"" investors in 1987 or 2008 
 They still suffered huge losses"
8782,I will rather a relatively small part of my portfolio in gold
902,"I would keep a relatively small allocation in gold 
 Perhaps 10% 
  This is a safety net. If your risk tolerance is so low that you don't wish to invest in equities and bonds you likely won'd make the maximum return on your portfolio"
2077,"I also noticed the anomaly 
 I paused, rewound, played it a second and a third time, and it still made no sense"
7164,A lot
6999,"Lol take a look at the video man  
 Cheers"
8871,"Small amount of gold, ready to stomach risk"
7020,Thank you for the answer
7700,"I would put something like 5 and 15%, because the cost of opportunities are very high If I want to make some money with investments"
7820,"Hello, my name is Palash and I'm a student of electrical engineering, currently in my first year"
7175,"Any recommendations of which are the best international financial/economic news 
 Something published weekly or monthly, something that keeps a big picture view/summary not only the details of one country or one company 
 Something that goes in line with what we learned in this course and keeps an objective outlook on what is happening 
 E.g 
 What Central Banks and investors see as the current and future situation 
 Thanks"
9096,Yes
1000,A large portion
5683,"Since it is a stable form of currency with a good base, I would prefer having a small part of gold in my portfolio all the time"
5701,"The crucial assumption that Professor Phillip Valta highlighted is that, when using ratios (such as price-to-earnings), comparable firms should have a similar financing structure (financial leverage) 
    Multiple-based valuation methods would be largely redundant in the time of the 2008 global financial crisis as a lot of company stocks would not be trading at fair value 
 Instead, a discounted cashflow method (although complex) may be the best route of valuing a company in times of financial distress"
8810,A small portion as a hedge against unlikely but extreme events
8740,I would invest relatively small part of my portfolio in gold
1022,You cannot always trust the numbers
7972,"Kyryl  Are you mentioning the complete series of videos  on WK 1 - Introduction 
 I also really enjoyed, but I think that lectures 2 and 3 should be labeled as ""Optional"" 
  I fear that people can be demotivated with those long ""advertisement"" videos 
 Anyway, it's personal perception 
 My suggestion:"
6137,"I would rather hold an smaller part of my portfolio invested in gold as an insurance, but ramp it up slowly as the dollar for example looses value 
 That would partially compensate for the effect of being late in a balck swan event or other, when the price of gold has already gone up significantly 
 So using the dollar as a “fever curve” to adjust to potentially higher risks would be adequate to build a better hedging position over time"
195,"I will allocate only a small part of my portfolio in gold as a form of insurance 
 The remaining funds will be in equities, bonds and alternative assets"
3827,"I would own no up to 5% gold in my portfolio 
 But it all starts with the amount of risk I am willing to take"
6087,"As a US citizen I get my economic information from financial papers and TV shows, so my perception is that given the circumstances US government did the right thing 
 It was a major global crisis with painful consequences and I do not feel that are fully recovered yet. The bailout of banks was necessary to get the economy moving again and encourage bank to start lending at a level that will increase investment 
 The process vary from bank to bank, they do not have the same level of confidence and given the experience they have been through they learned to act more cautious 
 After all they also experienced major losses, a couple of them (Bear Sterns and Lehman Brothers), vanished from the market like never existed, so I guess that was also a lesson to be learned the hard way for the remaining banks that no matter who you are or how powerful you might be you can be either bought or go bankrupt if you do not have your finances in order 
 There is no such thing like ""too big to fail"" although those which were considered that way if they went out of business we could have had a real depression and not a major recession 
 So, US government did the right thing and I do not think that banks assumed that that bailout will happen too soon assuming another recession is just around the corner 
 The vast majority of banks, business and investors play more prudently now and have a big cushion of (cash) reserves to be covered for the foreseeable future 
 Years down the road this may change, but as of now I do not perceive too many taking excessive risks and gambling whatever earnings they have"
1186,"I read your answer 
 It's pretty much similar to mine 
 Even i believe that it should be diversified 
 Don't know if it's a good idea"
6050,"The assumption of that past earnings will predict future earnings 
 In history prior to a the global financial crisis like in 2007"
4777,"Hi, Abel Oni. I noticed too when I took this course 
 I just became a mentor here, so I am not so familiar with the operation 
 But I will get connection with  transcript-maker 
 Thank you for your question 
 Enjoy your couse 
 Racheal"
723,"Although it might seem like a measure of which many are skeptical, right now it is showing positive results when compared to the Eurozone 
 Perhaps it is a necessary measure in the short-run, but they should definitely be vigilant to avoid disastrous consequences in the long-run"
3161,"The program from the US government enabled banks to take up their lending business again quite fast 
 In Europe, the situation was similar but the reaction was different 
 In case banks do not want to lend because e.g 
 They already have too many loans in their balance sheet, they cannot be forced 
 Through this, the bailout itself does not necessarily lead to a faster recovering economy 
 It is also depending on what the banks are doing"
4947,"You don't have to pay to take the test, after your successful enrollment onto the program 
 Check it again, Robert."
4827,"The assumption is that similar companies were correctly valued 
 Market inefficiencies could lead to incorrectly valued companies"
5044,"I guess that the US government's bailout of its financial sector was necessary 
 There can be potential bad consequences of this bailout in term of bad incentives for banks if new rules and new regulations are not implemented 
 Hardly any bad behaviors and decisions from big financial institutions have been sanctioned 
 If the rules remain unchanged, the changes that to see the same scenario happen again is quite high"
643,"History tells us that it was the Bush administration which pushed the banking sector in the late 90s to encourage lending to housing and real estate sector which ultimately led to the subprime crisis 
 So, it's true that sometimes governments give bad incentives to banks so as to further their own agenda, but in doing so it can hurt the economy real bad. Of course, it's necessary to bailout the troubled financial sector to foster economic growth but at the same time it's more important that the ""fiscal policy"" and ""monetary policy"" should work in unison so that the necessity of bailing out doesn't come out in the first place"
7417,"I think the duration of a bond it' s  when th bond ends 
 For example a bond maybe has duration 1 year 3 year 5 year 10 year "
1245,"Depends on the market, if the alternative investment market is good, smaller amount of money would be invested in gold"
8627,I would hold a small percentage to protect my portfolio against extreme events
4569,"Because even though it is easier to find, there are a lot of other factors that has to be taken inot consideration"
7912,I agree that biking out should have given bad incentives however in 2008 it might have been the only option available
731,It is not at all reliable in the real world
5102,Depends on market trend but I'll go with the small part of gold in my portfolio for insurance I can use options
6056,"Exactly, Bench-marking is when a investing firm sets the standard with a solid returns index and it marks how their investments should go, if its lower than the ""benchmark"" then the firm investments are going bad"
7845,"Hi   I was confused also, but it's simple, you have extreme negative returns more negative then positive 
 Also looking at it you can see there was a 80% chance of a return from 10% 
 So it's both"
3933,"Hi,István Nice to meet you in this course"
4666,"The picture basically showed a country going through a severe hyperinflation, meaning the value of their currency (cash) was worth almost nothing, hence the reason why the kids were allowed to play with the banknotes 
 There were two false statements 
 1) In the lecture slides the professor argued how gold could be used to hedge against the effects of rising inflation, ergo holding on to gold is a good thing 
 Unlike one of the statements 
 2) In times of hyperinflation people don't have money to save and wait to buy their goods 
 They tend to be desperate to get any sort of good the moment they can afford it, meaning they don't wait until the last minute to buy. I hope that makes sense 
 Good luck"
8063,"Benefit is 44 
 352/1.11+385/1.23+407/1.36+6047/1.36 =5376 5376-1000=4376 4376/100=43.76(approx=44) is i hv to take 43.76 as 43"
4365,"The multiple method is based on the assumption that assests that generate identical cash flow must have the same price 
 However, the price of the comparable company may not reflects the value of the company, for example, during the  _domain_  bubbles period, the computer industry was overvalued 
 For a company reported a loss, DCF valuation is better"
1499,"I would have invested a relatively small part in\ngold and stomach the impact that extreme events may have on traditional assets.\nTo reduce the risk, I would have diversified my investment portfolio and\ninvested in bonds and equity as well 
 Otherwise the price for the missed\nopportunity would have been to high"
956,"Anyone else having issues with the unique typing pattern match 
 I am unable to get through"
8118,"In this case ONLY we are adding percentages 
 It is because, in the Y axis of the histogram, we are simply representing how much percentage of the total data falls into that particular interval of return 
 So suppose there is a total number of samples of investment is 100. Since 40% of 100 is 40 
 Adding both intervals having frequency 40% each((0-10%) and (-10-0), we are actually adding 40+40 , which is 80 
 So this whole interval((-10 to 10%) acoounts for 80 of 100, which is 80%"
2726,Forecasting error
1087,"Similar financial risks 
 During the global financial crisis 
 One cannot use them"
7351,Thank you for your answer and very interesting articles
1801,"Just as an opinion, government must involved large private investors to help overall economy in general 
 On another hand, must provide to private investors future benefits to cover their damage as a long run. While banks will have a time and tools to recover from crisis of 2008"
7707,"In the lecture, he describes two scenarios for a 1000 dollar portfolio 
 One where you own 100 of a stock and the other where you short 100.  I understand the basic point: when you lose on a long bet, you own less of the stock, when you lose on a short bet you own more 
 This seems obvious by the very nature of the bets 
 However, what I am having trouble with is how he determines what portion of your portfolio the short bet actually is 
 What I am wondering is the net value of a short is zero initially:  you borrow 100 for a stock (-100), and immediately sell it (+100) and place the money with the bank as collateral so net impact to your investments is zero 
 This assumes you are one of the lucky few that the bank would actally do this for!  So for a portfolio of 1000 dollars, he seemed to be calculating that this net zero made up 10% 
   And he only put out 900 to make up the portfolio 
 In the other case, he had to invest 1000 
 So the example seems like comparing apples to oranges in some sense 
 When I initially answered the question, I stated that the relative position in the first portfolio decreased by assuming that we made 8.88% on the 900 (+80)  portion, and lost 80% on the 100 (-80) for a end value of 980+20 = 1000 with the 10% decreasing to 2% 
   For the second one it is not so straight forward if you think about it 
 We invested 1000 in the first portfolio (I assume real cash) in the second we only put 900 real cash, and have a 100 loan for the short 
 If the short increases by 20% and our 900 investment increases by 2.22% (20 dollars) then we can take the 20 dollars and pay for the margin call and still have net value of 1000 (although total value of 1020) 
   In this case, one could consider that the net outlay for the short is still 100 and for the other part is 900 - so the relative portions do not change 
 Or you could consider the total value of 1020 and compare to 120 which gives an 11.7% increase 
 I'm sure he did not mean for us to think this hard about it - but a ""real world"" apples to apples comparison would have been more useful in my opinion 
 And this leaves me with the question - how do you compute the actual value of a short in your portfolio"
1074,"I would have a relatively small part invested in gold and try to deal with the short term impact of extreme events by gritting my teeth 
 I would actually probably prefer to have more cash than gold in my portfolio to deal with political tensions, crashes, and black swans, because that actually seems like it would be an ideal time to enter the market 
 I'm new to this though, so what would I know 
 I'll be interested to see whether my answer to this question changes when I'm done with the course"
5375,"Using multiples-based valuation assumes that other investors in the market are acting rationally and that the assumptions they made in their valuations are correct 
 If they make mistakes in their own valuation, then the multiples are based on the faulty assumptions of others 
 They could be overvaluing or undervaluing firms compared to the valuation a DCF may produce"
5402,"In my opinion, the actions of the US govt 
 (and may others around the world) is a double-edged sword 
 What they have demonstrated is that the action to purchase the 'troubled assets' from financial institutions have helped the economy avert a protracted downturn 
 To prevent this action (purchase of troubled assets) from being construed as 'incentivizing' banks to be careless in their future activities and propagating reckless behaviour, the govts 
 Must place conditions upon the banks to be restructured over a period of time to correct the situation and at the same time develop an exit strategy for their (govts.) 'troubled assets' holding"
388,"I do believe that the purchase of TARP was necessary to post the US economy, nonetheless i also think that bank regulations has been to soft in order to avoid the bubbles in the financial and mortgage markets 
 As a consequence it would not be silly to say that in the next couple of years another depression would be likely to appear"
5239,"So in my analysis, and someone correct me if i'm wrong ( 
 ): 1) Market valuation means market capitalization 
 So in other words, Price * Shares 
 If you grab the price of a world stock index (E.g 
 Vanguard total market), then you can observe total market valuation with the use of a stock index 
 It all depends on the weighting, but this question, to my idea, can be seen as true 
 2 and 3) Are obviously correct 
 With booms and bust come overvalued and undervalued (or at fair value) markets 
 But a market can always become cheaper and more expensive 
 In other words, they can always move up and down 
 This can, for instance, be viewed in the light of the P/E ratio (how much earnings do i get for the stock price I pay?) 4) Seems incorrect 
 Some companies have little earnings but still have gigantic valuations (i.e 
 Unicorns such as Whatsapp) based on potential future earnings 
 They might not make a lot of money now, but they're expected to in the future, and thus have a strong price 
 As such, the market's valuation of the company is higher than book value (what it is worth now), due to the expectation of future growth 
 Also, the market may pay more for one company's earnings than it may do for another company with similar earnings"
7292,"Hi, Sameep Kodia, thanks for posting 
 Well, I want to what  other courses you learned so that I can avoid recommend the same course again 
 Have fun in this course~ Racheal"
2588,"Depending on the policies and regulations prior to that decision, it would be a good idea"
1578,"In the short term was definitely a good decision 
 In the long term, and as a decision that could be used in the future for crisis situations, its definitely a terrible decision 
 Banks have become since the 2008 sub prime crisis a risk free investment in itself 
 If they go down governments will bail them out. This will lead banks to further and further invest in more high return, high risk investments and will not translate, in my opinion, into a really economic recovery 
 Also in terms of the government annual budget is, and will be, a heavy weight to rescue a bank or several banks, slowing actually it's recovery 
 It has the benefit of assuring an enormous confidence in the financial system as the government serves as insurance"
