msgID,texte
3657,"You can have in portfolio the large part of the defensive stocks 
 For exsample, Nestle, Coca-Cola, Kraft Heinz and trend stocks, Altria 
 In this case you can soft the consequences of crash 
 So for me 5% gold in portfolio is enough"
2523,"I would keep  about 12% of my portfolio in gold 
 I would use gold as an insurance and not so much as an investment 
 Yes there is inflation, black swans do happen, dollar can crash and there always will be some point of political instability, yet even from the graphs show in this short video’s you see that markets recover again 
 For me gold will be used for these “crash” moments 
 If i would require to cash out some of my investments for whatever reason during such a period, i would be able to use the gold in order not to touch my other investments 
 History shows that markets recover and i believe one should find a balance in investment that once crashes happens you can sit out this crash 
 From the 12% of gold investment i would sell 3 til 5% during these crash markets to by new crashed products"
7689,"I would not have wanted to judge the value of a tulip by comparison to other tulips in Holland circa 1630, nor the value of  _domain_  stocks relative to other ,com stocks in the US circa 1998, nor the value of real estate via comparables almost anywhere in 2008 
 The market is not always rational 
 So it is wise to review company fundamentals to assess basic corporate health, and estimate earns, or at least determine the rate of return implied by the price 
 As for companies that have just released bad news, there is a school of thought that the market overreacts, and there is a buying window on the resulting dip.  But there had better be reason to think the company will ""bounce back"" from the bad results"
380,"I think it was important to save the banks as without them, the crisis would have even more lasting consequences for the economy, and it’s recovery would’ve taken a lot longer"
7808,"I would hold about 25% of my portfolio in gold, 25% in cash and invest the rest 50% in stocks and bonds"
2969,"The assumption is that the multiples are not overvalueted or undervaluated 
 In a bubble the multiples can be very high 
 But it could be the increase of earnings in one sector 
 Other consideration is that earnings could be the result of short term drivers 
 For instance, the costs of an aquisition 
 In both cases, there are a distortion, that can be better evaluated with a DCF"
7968,"Assuming that the economy is constant and stable during the period from which the data was used to compare 
 An example will be the recent crisis in 2008"
2234,Not participating
5884,The current price to earnings or companies that just reported a loss does not project future cash flows
7442,"1) It is based on evaluation from the future earnings (so these might not be precise) 2) The assumptions we make might not always be correct and e.g 
 Evaluation of current management of company and it's behaviour might be risky and not easy"
645,"I think she just mispronounced 
 It is called IPO which stands for Initial Public Offering 
 Although there is an ""APO"" in finance which is an ""Alternative Public Offering"", I don't think that's what she meant"
3508,Consistency
1449,"Choice\nin multiples can be subjective, it can be difficult to find comparable\ncompanies with similar revenue drivers, and the market value of the peer group\nmay not be accurate"
6257,"Dear sir  while valuing  company with a loss  it is more more prudent to see if the company has got  reserves on its balance sheet and adequate capital  to survive  a few hazardous years and eventually turn around .I do agree that the p e multiple ratio when compared with the stocks in the same industry is any easier method to calculate the value of a company or the price we are paying for a particular stock also I will like to attend the quiz later maybe once I understand the mathematics of it; the conceptual Part I have grasped 
 Thank you"
8878,"Agree, well maybe a 25% percent just to make sure that i have part of the money secure and the other part in assets that i can have earnings"
7930,"The NPV in 7 is the founded stock price in your answer minus the given stock price of 35 
 So lets say you get a stock price of 43, then 43 - 35 = 8 
 So a positive NPV"
9036,"The assumption is that other enterprises in the same industry can be used as ""comparable enterprises"" to be appraised 
 Yes"
72,"It really depends on the portfolio's profile 
 But if I was managing a portfolio for someone who's in his mid 40's, I would put 10-15% on gold 
 In a case of crash, sell shares to add more 10-15% on gold"
1945,"The bailout certainly did constitute a source of perverse incentives for the banks, even though if some aspects of the bailout were essential 
 Though going forward and in the run up to the financial crisis, it was ultimately the incentives provided by the government, and pseudo government agencies that caused the crisis 
 \n"
7333,"On cash risk - Is it in regulations that insurance coverage is necessary in case of financial institutions/brokers' bankruptcy these days 
 Which policies apply, covering which kinds of institutions 
 Who have information on the regulations 
 Thanks"
2874,It was necessary
148,"I would rather have a relatively small part of gold in my portfolio and stomach the impact that extreme events may have on traditional assets 
 Bc, the ultimate goal of investment is to let assets bring you more assets 
 By buying and holding a greater portion of my portfolio in the form of gold, which would devoid me of any reward for my investment, I would not be growing my portfolio 
 Thus a small amount of gold in my portfolio will help provide me with some or controllable protection against extreme or black swan events but at the same time the rest of my portfolio is invested in other assets would be generating rewards me rewards and hence growing my portfolio"
5710,"Hi  I am Puneet Kumar, from India 
 I am currently working in a Insurance company and interested in finance sector 
 I would like to learn about investing in stocks keeping in view the technical and fundamental parameters 
 I am very thankful to Coursera for such a great course and hope everyone likes this course"
207,"Without TARP, the banks would not have survived and the system would have collapsed 
 Bad incentives were simultaneously curtailed with regulatory changes, reducing the chances of future moral hazard"
6130,"How it works P/E ratio exactly 
 Why it matters in the stock market 
 Why it is useful sir"
5409,25% for gold
8962,I'd choose to leave relatively small part for gold
6361,"I believe it was a necessary step as to avoid what has happened back in the 1930s 
 And as to the possibility of the carelessness, I think that the banks can never be sure that the government will be ready and willing to bail them out every time, so they won't dare to risk to be too careless"
4595,"I definitely think it was necessary at the time as the whole country was reeling under a crisis that had the potential to increase even further 
 Since banks were able to clear off their bank sheets and get rid of their non performing assets, they were able to start lending again, thus boosting the economy 
 But, at the same time, there should be strict laws and policies against banks misusing this privilege and becoming more careless"
9094,"Yes, this was necessary"
8361,"I think it important to have a small share of your assets in gold 
 The reason is that, as the course had shown us, the prices of gold are quite volatile 
 Only a small fraction would be enough to protect you"
781,"Yes, i would like to invest in gold as an insurance 
 This is my opinion that after reaching a certain level market downs or there can be any unforseen event; which can certainly effect the market situation like; political crisis , credit policies, any decision made by central bank etc. so for the safety pupose we should hedge our fund by securitization"
87,"I would  have a relatively small part of my portfolio invested in gold to stomach the impact that extreme events may have 
 Other parts would be invested in stocks, bonds and real estate which are supposed to add value for the whole assets over time"
5012,"I would rather have some % of my portfolio always allocated to gold 
 Although it would hurt my gains when the market is good and stocks and bonds are riding really well, it would also prevent my portfolio from have even bigger losses when an extreme event happens 
 In short, I think that having gold in a portfolio is good because the safety net on a bad market compensates the smaller gains on a good market"
4726,"I'm sorry but I am one who uses both quantitative and qualitative methods 
 If they don't match up then it requires further investigation 
 What always bothers me is the so called Black Swan 
 Sometimes it could be a red herring but maybe not like the US tech crash in the early part of this century 
 It was a matter of recognizing a bubble using the methods presented here to determine how overvalued stocks were 
 How many bothered, not many because the quantitative method wasn't working well at that time as it turns out.  So this is where you have to say there is an art to all this no matter who you are.  Science will only go so far."
8205,"This is trusty issue, and about how banks recognize themselves as responsible or not. But the consequence of bailout can be catastrophe, and it's hard to blame when this happens 
 Till now, not many bankers are fully responsible about 2009 financial crisis"
8157,10 percent
6323,"No problem, so we'll try to do all the comunications by this way"
8447,Have a relatively small part
7520,I think 5 - 10% is prudent right now
2003,"Gold has the disadvantage to be volatile and to offer returns just a little bite higher than inflation and represents a high cost of opportunity for your portfolio 
 The portfolio allocation in Gold to hedge a black swann should be small 
 Moreover there exists in financial market other insurances against black swann, if we consider the Fukushima example mentioned by Professor Michel Girardin, investors could use CAT bond to hedge natural catastrophe"
961,"For the well-being of the economy as a whole 
 Other measures (such as regulatory) may be taken to address the potential consequences in terms of bad incentives for banks"
1161,"You need to look at the big picture, not at the most recent indicators"
1788,I have to think more on this subject
6490,"Personally, I would invest a small portion of my investment toward gold and rather allocate most of assets to other investments"
6243,Undefined
7490,I think that 10% is fine
8657,I would put a relatively small part of my portfolio in gold
7221,"Same words you've said were mentioned in the 'The Brilliant Investor' Book 
 Thanks a lot"
7795,"The multiples method is quicker to provide us with the enterprise value/price per share 
 But the quickness surely compensates for the following disadvantages 
 1 
 If we mistake on choosing the comparable firm rightly 
 2 
 We take the current multiples which actually are in no way a representative of the future growth/decline of the firm 
 Also ,the discounted cashflow method seems to be a more useful one. the reasons are as follows: 1 
 It takes into consideration a variety of elements which help us to formulation a better and a wider view about the company on which we aim to bid. 2 
 Takind into consideration the basis of statistics, more the number to factors we take into account, the lesser will be the variation in our expected price per share"
7282,"Victor and Wenzhe, thanks a million for the productive discussion 
 Alexander, the correct answer for profit is DEFINITELY NOT 7, but I would guess that Victor mentioned it so that he does NOT give the correct answer according to The Coursera Honor Code 
 I would strongly recommend that you look at his discussion with Wenzhe before mentioning the number 7 or the negative value because those are misleading 
 I mean, just focus on the process and logic of reaching an answer instead of looking at their 'intentionally-misleading' answers"
5776,"Hello my name is Vincent 
 I am a self learner with background in computer programming 
 Very interested in the specialization course and hopefully apply the knowledge"
6538,Bad incentives
4251,"Hello everyone my name is Qasim , I'm a medical student from Iraq and I'm looking forward to learn about financial markets and investment management, it's the field where the money are made  
  "
7272,"Thanks, Nicole 
 The calculation required to arrive to the correct answer is really VERY easy and only the information mentioned in the question is required 
 Hope that will help everybody else"
8933,Small amount
8446,Relatively small part
7339,Hi Jonas Yes Thanks I just finished week 2 just in time  _smiley_  Regards
4039,I think the government did it to help the country's economy not go down but there is always a second intention and that the government  should be ally with the bank for his own convenience for more money and power control
6354,"Hi did you get question 5  
  its just Benefit- cost  
  cost of the share you pay to the amount of benefit you receive from the stock"
6167,"I have around 3% o my portfolio in gold mining stocks 
 It partly serves as a hedge, but event more as a bet, for the comin inflation, which I view as inevitable with all the money printing over the past few years 
 Instead of gold ETF, I hold gold mining sticks for it has leverage effect, and was severely beaten down when gold price was low.   So I guess I view gold as an investment vein let, not as a hedge"
5456,"Bailout the banks who should be responsible for the Subprime crisis should be worried about 
 Central bank should be promoting so-called Goldilocks principle and making sure the banks learnt from the crisis 
 Without any penalty, the banks would quite likely to continue playing their securitization game and seeking higher return (comes with higher risk) when the economy is recovering 
 Without a braking system, with the business cycle, the future crisis wouldn't be prevented 
 So, bailing out banks comes with a cost"
2236,"As the question itself states, gold acts as an insurance against adverse market events instead of a lucrative investment opportunity 
 So it wouldn't make sense to own gold as a major part of one's portfolio 
 For a well diversified portfolio I wouldn't recommend holding more than 10% in gold either in the form of the actual commodity itself or gold etfs"
2353,"I believe that gold should be 5% of your portfolio as rather if you base it quantitatively, you should hold gold in the proportion of the volatility of your current asset class 
 So if your current portfolio has a 5% chance of a 2 standard deviation move, that should be the gold allocation"
144,"I definitely think the ""too big to fail"" notion has not been permanently fixed or clear direction provided in incase a similar crisis arises again 
 However, there has been a significant amount of goodwill lost by the banks and a general populist movement across the developed world og trying to reign in and better regulate banking activity 
 The populist component has been politicians on the right and left distancing themselves from having close links to commercial and investment banks 
 I think the banks have largely recognised this development and grudgingly accepted much of the regulation since the crisis like the Volcker rules 
 In the US, even if the Trump administration significantly loosens regulation again, I find it hard to believe that banks with take on the principle investing or proprietary risk that they once took as the next time around, there may not be enough goodwill by the population to let politicians rescue the financial markets again, even if that means short-term significant pain"
399,"Two firms are never perfectly comparable 
 Also a company with a just reported loss has certain ratios which does not make any sense (eg 
 P/E)"
5183,"Earnings float, a company that has had a bad year might have an horrible P/E but still be the top firm 
 Using this method we assume that all the company make the same decisions (investment, renewals, mergers and acquisitions etc) at the same time (this might be okay with a large sample of companies, but if a single huge company behaves differently from the average, it could bias our data) 
   If a company's got a negative earnings value, multiplying that value for the P/E of similar companies would result into a negative number 
 Share prices can't be negative or Enron investors would still be paying for their stocks"
3284,"At this time possibly it was required that the government helped with buying some of the outstanding bank debts, however I am not sure whether it was not risky for the government given that the bonds could have gone default 
 Indeed also some banks could be less careless when issuing debt and not paying back counting again on the help of the government"
4544,"Forecast for earning is hard to predict accurately, the economy cycle is uncertainty, so it's not wise to use multiples-based valuation methods"
3926,The ratios are based on performances of last years and they are not good estimators of future market conditions like inflation and growth rates can be different
5858,"By using multiples we implicitly assume that the companies are using similar accounting standards for income calculation, have similar capital structure and similar expectations of growth 
 Market based valuations are particularly difficult to use during recessions when most of the companies report losses"
1697,\nbad incentives for banks\n\n
66,"Like an example of negative earnings, they will be many situations where the multiple formula (Rule of Three) cannot applied 
 For example, it may be hard to find a comparable company in the same development phase or the same advantage such as manager, competitiveness, and processes 
 Another factor is that even though we can find a comparable company, we can't be sure the price of the company is fairly priced"
5159,"I believe we cannot solve everything while having no direct consequences 
 The decision made by the US government was an immediate solution so as to react 
 The bad following consequences may have been too difficult to predict"
64,"As the price of gold is cyclical, I would trade Gold 
 For Example the initial portfolio may have 10% Gold and then whenever the Price of gold goes down there would be more addition 
 This way we can have decent returns and also keep a hedge against uncertain events"
4570,"Assumptions:  the market prices reflect the real prices 
 Instances in history where not comfortable: When the markets are overvalued, for example during an economic bubble 
 A company that just reported a loss an has negative earnings would not reflect an accurate enterprise value 
 In this case it is not advised to use the multiples valuation method with the last earnings result"
3265,A failure of some bank will be a lesson for owners of bank
7479,"It depends on the time horizon for the investment, I prefer to always have gold with around 10% to 15% of my portfolio 
 I don not really doing that but I will do"
3804,"Purchasing of Assests and Equity from Financial Institutions are necessary at that point of time to bring the US economy back to track 
 CB could use other tools to ensure banks from following careless investment activity"
8227,"Hello Saurav, Can you help me with the outcome of questions 3 and 5 of the second week Quiz, please 
 I have difficulties to solve them 
 Thank you. Rafael Tárrega"
6143,I would rather to have a relatively small percentage of gold in  my portfolio in order to impact an eventually  black swan with the conviction that assets are supposed to reward in order to enhance my living standard
5389,Ya i belive that
1136,"HI Michael, if it helps review the third video titled, ""Emerging Markets: bonds,"" narrated by Ines 
 Also, it teaches how to compute the yield spread between bonds with similar denomination and like maturity"
5123,"I am from Brazil 
 In the past I have gold, because the inflation 
 But now with global world, and the action of Center Bank from principal contry working together, I have stomach to not have gold"
5537,"It has of course some effects on banks as 'incentives' 
  However, we should think about the results of crises when governments do not have bailouts 
 So, it seems that there are some really bad results having 'do nothing' policy such as domino effect 
 If one of the bigs goes bankrupt (of course this company is in huge debts) what happens to other companies 
 It will be a domino effect."
8303,"Hello Gene,, Can you help me with the outcome of questions 3 and 5 of the second week Quiz, please 
 I have difficulties to solve them 
 Thank you. Rafael Tárrega"
3297,"We assume these 'comparable companies' have similar financial structures (assets/liabilities), would be equally impacted by market forces like policies or macroeconomic conditions, as well as that they are not substantially different terms of by whom they ared managed, their products or what they invest in"
1652,"Glad someone else feels the same way! 
  You can't answer the questions unless you've studied math or taken an in depth excel course 
 They give you the formulas but don't explain how to use. I only have a bit of an understanding as I took a coursera math (excel) course, and even then I'm still lost 
 It's a great course but impossible to pass if you don't have the math excel background"
4683,"Hey Emmanuel, From looking at the histogram, they base their answer on the fact that the Russian histogram has a larger % of negative returns than the Belgian histogram; making Belgium less risky to invest in"
9084,"Yes, it was necessary to keep the people employed."
1806,30% of prtfolio in gold
4363,"For me i will support the bailout because it gives the banks more incentives to support the businesses to scale up to create more employment which improves the welfare of the masses and to also become more innovative which leads to outstanding growth in the economy 
 There is no stronger incentive to supporting innovation than having a strong belief that the downside is to some extent covered 
 For the reckless spending 
 The government can always tackle it through reviewing the laws guiding the banks"
322,I believe the US government's bailout of its financial sector was necessary
8223,"There are a few limitations that we should be aware of 
 Firstly, the assumption that the market has valued the business correctly 
 We saw this play out in the dot-com bubble, where P/E was 60 versus an industry average of 90, is a painful mistake 
 Secondly, all valuation metrics are based on past performance, and does not account for growth 
 Lastly (but not least), comparable valuation is no assurance that the ""cheaper"" company will outperform its peer"
1355,Right
4360,That future performance will replicate past performance
2093,I have the same question here
6061,"I understand risk as the probability of an event occur in the future given that it has not occurred until the present moment 
 Over my perspective risk can be positive or negative 
 For instance, positive risk of win money from lottery before having the results; and the negative risk of facing a bad weather during your vacation time only considering the forecasts 
 In addition, I have checked the glossary provided in the introductory lesson material; certainly these are more reliable than my personal understanding 
 Please see below 
 1 – According to Reuters Glossary: “The possibility that an investment or venture will make a loss or not make the returns expected 
 There are many different types of risk including basis risk, country or sovereign risk, credit risk, currency risk, economic risk, inflation risk, liquidity risk, market or systemic risk, political risk, settlement risk and translation risk.” 
  2 – According to Yahoo Glossary: “According to modern investment theory, the greater the risk you take in making an investment, the greater your return has the potential to be if the investment succeeds 
 For example, investing in a startup company carries substantial risk, since there is no guarantee that it will be profitable 
 But if it is, you’re in a position to realize a greater gain than if you had invested a similar amount in an already established company 
 As a rule of thumb, if you are unwilling to take at least some investment risk, you are likely to limit your investment return 
 For example, if you put your money into an insured bank deposit, which protects your principal, your real rate of return is unlikely to exceed inflation over an extended period.”"
3063,"If any of you are familiar with the current crisis in Venezuela; economically, politically and socially 
 What would your position be when considering buying Venezuelan bonds from PDVSA, a state owned gas and oil company 
 Obviously prices are very low, very good rate of returns, however, extremely high risks 
 Regards, Bernardo"
2117,"One of the risks of using multiple-based valuation methods is that earnings of a given company can be a result of one-shot accident (for example selling of useless property) 
  Multiplying such ""tweaked' earnings by P/E ratio of a comparable company can simply lead to overvaluation"
