msgID,autID,disID,theID,ts,texte
37,36,35,4,2016-11-20 12:05:16,A firm needs to use multiple valuation methods to ascertain the realistic valuation rather than trusting on one particular model
6964,214,144,4,2017-09-02 22:22:34,"On the surface, the bailout is actually necessary for in order to speed up economic recovery 
 However, there should be a strict scrutiny of banks financials and there should be a law from regulatory authority guiding banks on the kind of assets they can invest in and the ones they can't"
3942,999,451,4,2018-11-13 16:22:37,"I would have a relatively small part of portfolio invested in gold just enough to counter the impact of black swans at all times because probability of them happening is low. The traditional assets like stocks, bonds etc. increase your wealth and are the ones that will help you achieve your investment goals"
3352,2366,80,4,2016-07-21 17:31:47,"Well, me must be very very very careful with these companies that just report losses year after year 
 Too risky 
 I would never invest in these awful firms 
 Sure way to lose money 
 :(\n"
2391,1840,280,4,2016-09-08 08:55:54,"\n\nWhat could that assumption be 
 Similar size of business   Similar level of management competence and strategic approaches to goals and achieving them   Similar competitive advantages and long term sustainability of businesses   Similar expected results in the future   \n\nWere there instances in history where you would not have felt comfortable using multiple-based valuation methods to value companies 
 Yes, no similar companies traded on stock exchange - nothing to compare with 
 Some of key business characteristics are similar some are significantly different (there are no ""twin"" enterprises)   Different business locations and thus market limitations to further growth of some companies    What about companies that just reported a loss (i.e 
 Negative earnings) 
     Such companies would suffer significantly due to market fluctuations of their share price and often not fairly, as such changes in market price might be just one year in a row distortion but not a trend 
 Markets are too nervous often and overestimate long term effect of current news"
1485,1253,167,4,2016-09-12 07:24:02,"Ultimately, it's (ideally) about building a balanced portfolio accounting for different types of returns and risks 
 Gold continues to be one of the asset classes/tools in achieving this ""balanced portfolio."""
5650,2798,145,4,2016-03-04 01:41:50,"I'm worried bout the consequences 
 The CBs have pumped enormous amounts of fictitious cash into the economies 
 That has to hurt at some point"
8944,1569,157,2,2017-03-13 04:58:25,Small part in gold because we have to diversify our portfolio
4882,1029,32,4,2016-06-15 15:00:58,"\nI highly recommend 'Corporate Finance Essentials' offered by the IESE Business School, here in Coursera 
 It explains in detail, but very intuitively too, many of the concepts that this course discusses, like returns, risk, diversification and the Cost of Capital.\n\n"
825,750,103,4,2017-07-19 18:03:46,"Gold will be a third of my portfolio as it ensures the safety of my living, one third I will have it to"
2018,1609,277,4,2016-06-19 22:55:53,The company is indeed similar enough to other companies to infer that non DCF methods are accurate
1055,744,373,4,2017-01-08 18:45:33,"The principle assumption we make when using ratios observed in the market to value a company is that the market is pricing the company correctly - i.e 
 It is acting irrationally 
 It is clear that there are times when this does not happen 
 For example, I would be uncomfortable relying on multiple-based valuation methods when valuing technology stocks in 1999 or 2000 at the height of the dot com bubble 
 Indeed, it is impossible to use earning ratios to value a company which has reported a loss"
691,637,7,4,2016-03-20 18:23:00,Companies in new industries or geographical areas
151,144,120,4,2017-07-11 11:44:18,I think time will tell how this plays out. The TARP program is an example of fairly unique approach to protect the economy and there are no historical examples to provide insight into the effects
3114,634,117,4,2016-06-10 21:03:47,"The answer of this questions depends on the bank country by country 
 There will be a mixture of each well being and possible bad incentives of banks"
8090,3703,1122,0,2016-02-21 20:00:09,"And also you can give the exam before 8 hours 
 Try it out again"
1665,1385,9,4,2016-03-29 14:11:47,"From the history the FED is a private entity with all the big names in the banking/finance  sector they will formulate  these kind  of unconventional policies even if the banks are so careless in lending money to companies or individuals who do not have the credit worthiness  
 In this so called TARP program FED purchased the assets of the same financial institutions which are the shareholders of the same FED 
 The outline is that they are willing to make their own assets more valuable which actually worth much much lower if we look at the actual value 
 So,to my view it is a complete control of one big entity even after actually understanding the real consequences that the USA along with the other countries of world are  going to face 
 We must have a central bank that really works for real growth of economies without any selfish intentions and NOT by using these UNCONVENTIONAL  ways of policies for their own greed"
546,508,82,4,2016-09-29 12:39:59,"The architects of the crash were the same people to put the bailout packages together 
 According to Noam Chomskey, financial institutions are already factoring future bailouts into their risk models, effectively justifying further reckless lending 
 The public must not pick up the tab for this"
5293,3176,620,4,2016-11-02 13:00:35,"Using DCF can be a corrective to the multiples, especially if you have detailed knowledge of the company and want to do a more detailed analysis or scenario"
7681,3777,18,0,2016-02-25 09:37:55,"Hello Matteo, Can you help me with the outcome of questions 3 and 5 of the second week Quiz, please 
 I have difficulties to solve them 
 Thank you. Rafael Tárrega"
3442,773,283,4,2017-07-25 10:46:18,"In my opinion the TARP initiative taken by the central bank was to mitigate the impact of the crisis in the immediate effect 
 It was important in that moment of time as the economy required a much needed boost and buying the impaired assets of the bank was important 
 After this much needed first aid the Basel 3 norms were adopted which imposed a much stringent regulation on the bank in case of borrowing and lending 
 This was done in order to give a message of caution to the big banks 
 The bottomline is the bailout of the big banks by the central bank was indeed important and it surely impacted the world economy in a positive way after the aftermath of the crisis"
8122,48,1229,0,2016-08-22 18:03:14,Try the t=0 the first season of revenue (1.11-0.04) no squared
9112,1593,635,1,2016-02-15 15:49:30,"Hello from a Lebanese in Lebanon 
 Previous to this course I had no idea about finance and stocks (I'm an environmental engineer interested in finance (Yes, we do exist)) 
  This course seems really promising though, and I'm really enjoying it till now! Hope we all learn something new! All the Best"
4265,2326,449,4,2017-08-03 05:27:55,"The bailout was necessary 
 Teaching a lesson, although important, is not the most important thing in a financial crisis 
 The government should look for ways to solve the issue rather than continuing it just to establish a precedent"
800,707,145,4,2016-02-21 02:00:32,"The United States has laws and procedures to conduct orderly dissolution of insolvent companies 
 These procedures were never given a chance to work in 2008 
 Many  argue that the financial crisis would have never happened if the government hadn't set precedent with the bailout of Continental Illinois National Bank and Trust in 1984, which at that time was considered ""too big to fail"" 
   If you went to Las Vegas, and knew you got to keep all the winnings and any losses would be covered by others, would you gamble prudently 
 One of the tenets of capitalism is that you enjoy the rewards of taking on risk, but you also suffer any consequences 
 I believe it would be better if the government would leave the markets alone 
 We wouldn't have had the subprime crisis in the first place if not for government meddling where it should not have been"
4975,3055,144,4,2017-08-20 18:49:54,"It is a double edge sword 
 Offering incentives may have support banks against the ""too big to fail"" 
  It is necessary to have very rigorous check & balance in place to avoid wrong bank behavior in the future"
3242,2311,338,4,2016-05-29 19:29:06,"That depends 
 How far a crysis could go 
 That's the point 
 Banks cannot go banckrupt, as it impacts severely on both the main goals of the CB's, as well as overall life of the people 
 But they should not be unrestraint 
 Bailout of banks should be followed by restraining policies, in order to disencourage their recklessness"
1557,1304,468,4,2017-12-05 21:27:12,I would put a quarter in gold
2349,439,629,4,2016-02-22 00:45:56,"As Julio suggested, you need to round your results 
 Only input integers into the answers )if you haven't already done so by now. 
 )"
1621,1355,525,4,2018-10-31 17:16:51,"Bailouts lead to potential or rising moral hazards and consequent to investors losing faith with banks 
 The introduction of ""central bank guaranteed deposits up to $$ amount"" is an example how much faith the ""lenders"" to banks have in real world today 
 The banking system today is not as reputable/stable as it used to be 
 The evolving of crytocurrencies and disruption to the financial system in particular in recent time shows how much the public dislikes CBs and the banks 
 This leads to Fed and CBs introducing measures to ""tight"" down or eliminate the expulsion of alternative financial services 
 Fear is in the air"
2426,89,636,4,2016-03-13 23:01:44,"Ketki  here is important to make a distinction, the very last lesson is not about buying long term bonds, but about buying long term bonds and shorting  Short term bonds, which works in an environment similar to the recent where low expectations on inflation , allows the fed to  send a message of low inflation on the horizon while it   raise interest rates, which is also an environment for high increases in the short term generating lower increases in the long term tail 
 But keep the eyes open 
 Stamatis In my opinion this is the most interesting part of modern finance, and asset management not an straight set or rules but rules that must be used according to the environment in which they are applied 
 You have to be very cautious  in making those distinctions 
 The problem is if a pension fund manager doesn't make this distinctions and jus buys Bonds for older people with this rates because ""it is less risky"" 
  I think The serious problems  to think about are in the assumptions of infinite growth with limited resources, or with humans able to be satisfy their needs and find a steady point of consumption without destroying the environmental stability of the planet, can we think about green GDP? about  social well being GDP? cultural (anti-ignorance) GDP"
5878,2511,18,4,2016-02-14 07:40:55,"In my opinion the most obvious assumption while using multiple based valuation method is that the firm will continue to perform in same manner in future as that in past 
 In general most often multiple based valuation fails to factor in prospective better future performance or overvalues past performance 
 Historically, I would like to point the period around  _domain_  bubble 
 During that period lot of  _domain_  companies were overvalued and using multiples for valuin companies would have resulted in unfair valuation of stocks 
 Same applies with the companies that have just reported loss, their business model would have been like that which expects to generate earnings after certain period and valuing them based on multiples would actually be not considering their prospective future performance and leads to undervaluation"
8438,4011,150,2,2016-04-07 19:44:36,A relatively small part
2277,1771,44,4,2016-04-07 23:10:03,"During the dot com bubble when stocks were overvalued and during the housing bubble when mortgages were overvalued, are two instance that a multiples valuation method would not have been appropriate -- but then again how could you know"
5445,3226,371,4,2018-03-22 10:17:41,"Both 
 That's the problem with all economic policy: it's focused in solving the short-term problems, but inevitably that will cause long-term problems 
 The key is to know when to stop with those kind of programs before the problems caused are more severe than the ones we're trying to solve"
909,817,72,4,2017-05-21 13:35:37,"There are 2 main assumptions, in my opinion 
 The first is that the current ratio on the market is also the correct one, that is, that comparable companies are correctly valued 
 The other assumption is that our company will have the same development (growth, etc.) like its peers is it compared to 
 It is dangerous to use multiple-based valuation methods in overvalued markets (bubbles) and in volatile markets 
 For companies with negative earnings we can use other ratios, such as price per sales 
 However, in this case it is important to understand whether this was a one outlier, due to a high investment or a merger, or if future cash flows are in danger"
1252,614,473,4,2017-07-21 03:13:28,"The policy of the Swiss National Bank is very interesting 
 It keeps the Frank unattractive by lowering the interest rate, but to avoid that people rush to request credit  for buying houses (that would repay cheap) the policy requires people to have a significant part of their own money to buy the houses 
 Intelligent"
117,113,41,4,2017-05-27 14:08:01,US government should give a closer look to bank policies until they arrive a more normal conditions
3547,2476,84,4,2016-12-12 20:35:27,"I would have around 33% of my portfolio invested in gold at all times as it is a very useful hedging tool, and provides some sort of steadiness in the portfolio 
 The rest of the money will be put into the various stock markets around the world, exposed to different sorts of risks"
2892,2127,41,4,2017-05-10 16:06:53,"I think that any bad incentives that may have been created are better understood now. The risk of these same unintended consequences is now less 
 SOX, reserve requirements etc have actually probably caused banks to improve their credit assessment criteria and the question is probably more so did the govt overstep in terms of regulation of credit"
236,43,164,4,2016-02-08 14:54:30,"Hi Alan, Thank you very much for your feedback 
 I will pass the message on to them 
 Best regards, Jonas"
3781,2522,431,4,2017-09-11 05:46:17,"I am not concerned because governments have increased / improved regulation and macro-prudential rule on banks after the bail-out to avoid this type of excess in the future 
 Some argues that government went to far on regulation with Basel III, etc. Austrian's economists did not like the bail-out (because of distortion and moral hazard problem), but without it the consequences on ´regular' people would have been dramatic (very high rate of unemployment to clean the mess)"
7899,2310,153,0,2016-03-02 19:23:28,For now 2016/3/2 20% in Gold  20% in Stock market 60% in Crude Oil
7992,844,1238,0,2017-07-21 02:48:35,"It is just amazing after we learned about all the different components of a bond to dig deep into the effect of the Yield Curve on economic growth and how it's inextricably linked to monetary policies 
 For example: 1- Normal Yield Curve= higher interest rates in the long term= easy MP 2- Inverted Yield Curve= higher interest rates in the short term= restrictive MP 3- Unconventional Monetary Policies: are those in which central banks buy bonds and use Quantitative Easting QE to create liquidity not only in the short run but also in the long term"
1539,118,517,4,2017-07-21 02:17:23,"I'm signed up for this course from the beginning to the end.  I'm looking forward to getting through each class and to the capstone 
 I'm anxious to start"
2598,1951,153,4,2016-03-09 10:46:59,"I would hold about 10% of my portfolio in gold 
 I don't think there should be more gold as the portfolio will be diversified with other asset classes 
 At the same time as far as I live in a country with an emerging market, that faces a great economic decline nowadays, I wouldn't put less than 10% of gold"
717,662,153,4,2016-03-11 23:12:15,A smaller percentage to serve as a bridge to compensate during a financial crisis of black swan event.
4576,418,9,4,2016-03-14 11:07:22,"This question concerns more the philosophy and principles and shows that economy is rather a social science 
 Bailout is not exactly what a liberal capitalism is based on and certainly is not what one could call fair 
 On the other hand a collapse  of entire banking system would have a profound consequences for everyone 
 At the point when the decision were made the outcome wasn't certain and we can only judge by the final situation"
568,528,297,4,2016-03-30 21:53:24,"Hi Janice - the World Index is based on the market capitalisation of the shares from the countries that are included in the index 
 It won't include a country's infrastructure unless the infrastructure asset is privately owned and the owner's shares are listed on a stock exchange 
 One of the main World Indices is compiled by a company called MSCI - you can find more information at    Another company that provides a World Index is FTSE Russell 
 You can find a downloadable factsheet on their World index on the right side of this webpage:   Hope this helps"
2643,48,666,4,2016-12-09 16:25:15,"The NPV formula is the right way to calculate for a project because NPV show us if the project is profitable or the project has no profit for the investment 
 I think the methods to decide for project are IRR Payback methonds, Sensitivity analysys, NPV. And dont forget that NPV based in DCF theory and methods"
3278,756,145,4,2016-03-03 13:14:31,"In my opinion, bank bailouts by US and other governments were necessary as long as a systemic crisis and a severe economic depression were avoided 
 For example, the bailout of AIG and other systemic banks (known as too big to fail) in 2008 prevented extended panic in financial markets and the real economy as well 
 The TARP program also helped the US banks to be able to lend soon in order to boost economic recovery 
 However, future bailouts should be avoided because taxpayers' money should not be used to save large banks who have taken excessive risks 
 Macro-prudential tools, bank regulation and supervision would relieve the problem of excessive risk-taking and probably would not allow another financial crisis to prevail 
 Concerning the banks that have been already bailed out, regulators should investigate deeply the causes of their collapse and impose fines to the people who were in charge"
6249,2482,431,4,2017-10-07 11:04:14,"My opinioin that Central Banks should make more efforts to analyze and prevent in future causes that lead to formation of these low quality assets because operate with consequences are always harder that prevetion 
 Purcashing assets is quick and effective method of cleaning bank portfolio, but it is only one side of the coin"
6290,3516,0,4,2017-12-05 13:56:17,"There is one assumption of the P/E ration -- If the required return increases, the PE decreases 
 AKA, as investors assess more risk, the PE adjusts lower"
2203,1215,19,4,2016-04-05 16:39:06,I think it was necessary
4812,48,879,4,2016-08-25 21:20:49,For the first a undervalued currency  means that the exports going up and this mean a increase in GDP. The second lower interest rates mean that quantity of money in the market is bigger
2465,1096,192,4,2016-08-28 12:30:54,"Bad incentives,; there should always be consequences for poor decisions"
6348,3530,350,4,2017-06-02 08:31:32,"I suppose Gold is a good form of investment now that we understand how it works to protect our assets against the unforeseen events 
 However, I believe in having a more diverse portfolio to manage the risks in any case rather than just putting all eggs in one basket 
 Probably a 10% investment"
5633,3300,18,4,2016-02-21 04:53:09,Major changes positive or negative in future earnings past the upcoming year are not captured with the multiples based valuation methods as they are with DCF methods
7788,2240,76,0,2018-10-07 10:02:37,No more than 5% in my portfolio
499,467,34,4,2016-03-20 22:46:38,"In my opinion, central banks should never bailout commercial banks because the bad incentives to take too risky positions can provoke another financial crisis"
5672,1450,140,4,2016-11-11 19:48:03,"It depends on your stage as an investor, if you are young , you should have just a small amount of gold in your portfolio, when you have reached maturity and need to preserve your assets and avoid ""black swans "" would definitely increase"
2525,1916,650,4,2016-02-28 12:46:49,"Hey Susana 
 Did you tried all possible answers with only one or more than one mark"
6294,3376,620,4,2016-10-27 11:10:51,"--Assumptions could be,   we may not have the same standards asother companies 
 We assume that we have similar P/E ratio as the market which may not be true sometimes 
 Maybe the market is thriving while we are facing difficulties, or vice-versa 
 --I wouldnt have felt comfortable using multiple-based valuations when there was an ongoing crisis/war and predicting the future valuables will be difficult 
 --about companies that just reported a loss i should find out what caused them to have a loss, is there an internal problem that only they have, or its was caused by the market that will affect meas well"
7896,3783,106,0,2018-10-05 13:40:30,Where did the .08 come from
6460,1087,67,4,2018-09-01 08:52:42,"Holding about 10% of my portfolio as investment in gold seems sensible for me 
 As the opportunity cost is well covered by the other investments , as well as it provides a minimum hedge in case of a black swan situation"
3138,2262,61,4,2017-11-26 17:46:15,"Difficult to find comparables with identical or at least similar revenue drivers 
 Choice of multiples can be subjective"
8738,3633,59,2,2016-04-19 21:18:33,Small part
6490,2015,52,4,2016-06-07 20:05:53,"Personally, I would invest a small portion of my investment toward gold and rather allocate most of assets to other investments"
2808,2074,134,4,2016-03-06 15:36:46,"Ratios are based on current performance and the present does not necessarily equal the future 
 Projecting future cash flows while takiing into account changes in management or corporate culture can be more accurate"
1846,272,546,4,2016-06-18 17:34:31,"Thank you for posting your question here 
 Even I had that question a couple of years ago.  I think Artem and Palash have already answered your question (great answers!) 
  However, the following article will show you the implications of printing money in a more practical manner 
 I think by now you have understood printing money is not a solution to repay the debts 
 So do you have any other options as to how a government can get rid of their debts?\n  \n"
4623,1754,292,4,2016-07-07 22:45:36,"To add, I do think in the US's case, it was necessary--no matter the risk"
4030,2690,2,4,2016-10-14 04:26:25,The main assumption made is that the asset that generates the cash flows of the two different companies have the same price
3375,2380,388,4,2018-05-30 15:22:02,"We assumes that the companies are similar 
 No single method is appropriate by itself 
 If a company has reported a loss then you can't really use some of the ratios like P/E 
 P/Sales might be a better ratio"
6826,1919,1025,4,2017-07-21 03:08:09,Is there any formula for it
7669,2330,532,0,2016-02-29 13:40:36,"Hi Jaime I was thinking far to complicated when trying to find the correct answer to this question 
 Actually it's a very simple calculation:   Take your answer from Question 3 and subtract the given share value of 35 USD from it and you're done  _smiley_"
8998,4197,507,1,2016-04-17 06:37:53,"Yes, i also Note It"
6013,3143,258,4,2017-04-14 10:47:11,"Well, US in this situation is sort of a ""lab mouse"", because it has to go through something many countries were hesitating to do 
 Therefore, we need to see in the coming years what is going to happen in the US, but so far so good"
5471,1029,832,4,2016-06-15 15:09:52,"Well, from my point of view the terminal value refers to the expected cash flow of a future period (after the first N years) 
  As a result it has to be discounted, that is we must calculate the Present Value of this future cash flow, in order for it to be added"
7013,29,1052,3,2017-05-04 02:00:27,"Hello Nicholas 
 Welcome to the class"
5093,432,87,4,2016-03-25 10:19:51,"I do apologize 
 It's not a joke and I really received an email from our professor about the date of starting next course 
 Please keep calm and we will enjoy a fantastic course: )"
8638,2316,171,2,2016-08-13 14:15:33,A relatively small part
1582,1324,117,4,2016-05-25 19:41:55,"It's never a win-win situation 
 The bailout was necessary to avoid the next Great Depression of the 1930s, however, it did not address the regulation and risk-taking nature of the financial and banking sector"
6043,3443,270,4,2017-07-10 20:22:12,I would invest 40% of my capital in gold
5942,1762,34,4,2016-03-21 00:10:05,"In my opinion, the banks bailout in times of crisis is an essential bad, given the super-connectivity that links several other institutions that are part of the modern economic society 
 Therefore, despite being an unfair and risky exercise, nonetheless is necessary for the proper functioning of the well-being state"
9049,4210,62,1,2018-07-23 07:04:46,Yes
7334,131,1073,3,2016-02-12 07:15:03,Hi Thiery
