msgID,texte
1581,"It depends on investors profile, if the investor is conservative he/she should probably maintain a large portion of portfolio invested in gold whether someone who wants to have higher returns and understands higher risk related to that should only have small portion invested in gold"
7741,"I personally would like to invest somewhere between 10-15% of my portfolio in gold at all time 
 This share of my investment pie can increase up to 30% at the turbulence"
6475,"I guess there are many assumptions: one of them is that the information is correct, something that can't always be taken for granted 
 The other, that the earnings of a company in a given year is truly representative of its real situation and prospective earnings in the future"
4809,"The  _domain_  bubble market psychology drove multiples well beyond realistically expectations of future cash flow 
 This lottery driven mentality pushed  valuations well beyond reason and resulted in a rapid and expensive market correction 
 SaaS company valuations (Recurring Revenue x multiple) has had the same effect of overvaluation"
669,"There is however a very important assumption we make when we use ratios we observe on the market (like price-to-earnings) to value other comparable companies 
 What could that assumption be 
 The assumption is that companies trade at a fair market value in the short term 
 Were there instances in history where you would not have felt comfortable using multiple-based valuation methods to value companies 
 Yes, specially when because of policy the expected rates of return where distorted, for example with the Fed or Central Banks easing money to the financial system and lowering the interest rates that in turn would have lowered the expected rates from investors in equities which by using the Multiple-based Valuation Methods  would have driven the prices up making the companies more valuable fictitiously 
 What about companies that just reported a loss (i.e 
 Negative earnings) 
  They can always be evaluated but based on sales, but this shot term valuation would no t necessarily reflect a fair market value"
9131,Yes
7883,I've rounded my answer to 25 (as it was said in the question: round to the nearest number) and it was accepted
5326,"The assumption mentioned is: we expect that equity price reflects fair company value which is not always true 
 The whole specific industry might be overestimated (so called ""bubble"") the way is happened in early 2000s with Internet/ _domain_  businesses 
 The second problem: we can't use P/E or other ratios when estimating companies which do not generate positive cash flow: startups, early stage companies etc"
919,"We are assuming the comparable firms are in the similar growth stage, similar industry and financial structure"
2335,I think from here
2690,"I think both, the bailout was completly necesary you cant as a goverment let the hole financial industry  (banking, insurance, loans, Mortgages etc) go under because of the domino efect that would had in other industies that rely on the banking sector, plus other cosequences like unemployment in conclusion the whole US economy would collapse, but in the other hand you give all these incentives to the banks  and who guarantys that in the next financial crisis the US goverment its no going to have to go rescue the banks again, speacially  if its still an unregualeted sector more worried to make profits with new finacial instruments more complex, in a 7 years bull market are they prepare for the correction 
 Or prepare for next buble?i think of more that bad incentives we need more regulation both for the banking sector and what these banks are aloud to trade "
4452,"It is worrying as it has set an unprecedented example for bailing troubled financial institutions rather than letting the market to adjust 
 I think a bigger recession is coming"
1954,"From my opinion, bailout of the financial sector is sometime necessary 
 Without the help of government, the superior amount of bad debt will lead to enormous unemployment and it leads to huge social tension 
 In the other side, regulation must be set. Government should set the boundary for the bank business 
 The regulation and independent business should be combined together"
2198,"I am more worried about the potential consequences of this bailout in terms of bad incentives for banks 
 I think the economy itself should be able to recover from the crisis 
 What the government did just break the balance"
8455,Small
2863,"I'm clue less about the situation in USA, but I know that in Europe there is a law that impose the bail in of the banks in case they do bankrupt 
 On my personal point of view, the problem is ""banks"" as a whole, I mean that the mechanism of credit distribution doesn't work anymore in the real world 
 The distribution of wealth is very unequal and unfair and the death of the middle class impose some change in terms of government priorities  
  In the European situation, in Italy foremost, banks have not any incentives to land money, because they have already a big amount of mortgage contracts in their portfolios"
1919,"I believe in being prepared in all cases, with that said it seems like a fine balance is required 
 The idea would be to minimize the negative effects of something is something bad happens to your investments not necessarily to insure them 
 I believe as your investments mature and you age as well a rebalancing to purchase more gold as an insurance policy would be required 
 I believe a younger investor can ride the ups and downs with less effects over the duration 
 So a portion of gold in this case to minimize the losses"
384,"P/E ratio is calculated using historical performances, which might be the best forecasting method available, but are never a reliable one. In a bear market, I might have felt comfortable using this method because all companies ""seem"" to be doing well in terms of yielding positive returns 
 If a company reports a loss in the period of time during which its performance is being assessed, we might have a negative P/E ratio, but over the whole period of the companies existence, the P/E might be positive 
 So, I would dig deep to see whether the reported loss was because of a temporary loss of performance or whether the flaw was really fundamental, before deciding to invest in it or not"
9162,"Yes, Aristeidis it is a great idea for some degree of interventionism is put in place to curtail their excesses 
 I wonder if any such interventionism exists 
 I don't think the terrible state of the bank's books was absolutely their fault since it was a result of the bubble in the 80s, however, if another bubble takes place, the US will still have to perform the ""TARP"" again 
 It seems more like a cycle to me"
5393,"The truth is that banks are the institutions that ""create"" money and therefore are invaluable to the economic growth and well-being of the society 
 Despite these facts, banks are private companies owned be private shareholders, so their main incentive is to make more profit 
 The subprime crisis in 2008 was to a certain extent a matter of greed from financial institutions (and also private investors) who found a way to make more and more money without considering the bubble that was being created 
 As a conclusion, I believe that the banks needed to be saved because the economy cannot grow without them 
 But the government should learn from financial crisis like the 2008 one, and take some serious measures and regulations for financial institutions, in order to prevent future crises"
4882,"\nI highly recommend 'Corporate Finance Essentials' offered by the IESE Business School, here in Coursera 
 It explains in detail, but very intuitively too, many of the concepts that this course discusses, like returns, risk, diversification and the Cost of Capital.\n\n"
2834,The assumption that we make is the future cash flow is growing in a constant rate
2730,Why is currency risk more significant in bonds than in equities
6932,There could be other factors like depreciation which contributes this
1768,"Gold works like insurance of a portfolio,  which is largely consist of stocks and bonds 
 Just like any other insurance premium gold part should be relatively smaller percentage like 5 to 10% of total asset allocation thus in case of economic crush like 2008, the overall portfolio still retain some of its value"
8159,"1) we assume the ratios are based on pure financial values, while other external/internal factors could impact on these values like financial crises, industry crises, M&A, investments, mortgages, etc. 2) as said, financial crises like 2007-2009, but also Amazon extraordinary revenue based on cloud services AWS revenues or when Vivendi bought a big slice of Mediaset shares 
 3) ratios could not be used and multiple-based valuation would be useful to understand how far is the Company from being in the arena 
 I would investigate more on the reasons 
 Like: If also other similar Companies are in the same situation then the industry is under a crises and I would not invest"
3614,"As such events although not impossible,are very unlikely to happen 
 So it would not really be a wise strategy to invest a large part of the portfolio in gold because then we tend to lose out on the opportunity to make money by using other financial assets 
 But,nevertheless investing some amount of money in gold for security purposes is always a welcome move 
 Since ages, in my country-India,parents have been investing in gold by buying jewellery such as rings, necklaces and bangles so that they can use these assets during their child's marriage ceremony which often is celebrated as a huge event 
 So this thing has been going on till now and therefore I can say that people of India have been practicing gold investment since a very long time"
8525,A relatively small part
5752,"I m akshita singhal from India 
 I am very much excited for the module 
 Hope to learn new things"
2764,I would tend to the option to have a larger part of gold in my portfolio
6514,"I think US government or any others\naround the world bailout of  its financial sector was simply\nnecessary for the well-being of the economy as a whole because US\ngovernment wanted to help the US economy to recover faster from the\nsub prime  crisis by removing illiquid and difficult-to-value assets\nfrom banks balance sheet encouraging them to lend money to the real\neconomy 
 Actually, here is no bad incentives\nfor banks, so having no scope to be worried about the potential\nconsequences of this bailout"
5112,"I think that if the opposite happens and the yen rises, then the investment in euros would be profitable 
 And that is why when investing you have to keep in mind the currency gap and treat it separately 
 Hope i helped."
7652,"Ok, I think we get a certificate after completing the 4 courses + cap stone project 
 It says so on the course main page 
 Anyone correct me if I'm wrong"
8292,"A larger percentage; because I think conservatively, maybe 20%"
6736,"I don't know how necessary the TARP program was, but it has seemed to help 
 I think there should be more oversight with the banks so they are not so careless with their future activities 
 I think the Dodd-Frank bill was a step in the right direction, but not perfect"
8781,A relatively small part of one's portfolio in gold should be enough to safely insure part of the investments against negative events and losses
7138,How did you get the answer
7943,"Hi, you basically solved it so I am not sure about the question:   We have (1 + R)^45 =  40   so if we extract the 45th root of 40 we have 40^(1/45) = 1.08542- This is equal to 1+ the rate so we subtract one and have  .085 =  8.5%"
742,I think that 10% of your portfolio should be invested in gold
8256,May be 20 %
2562,"I would make a couple of caveats here: overall, I think 25-33% is my target range, but I'm not just talking about gold 
 This includes physical gold, but also physical silver, (maybe also small amounts of platinum/palladium) as well as a small percentage in mining stocks (a huge growth potential but very high volatility) 
  I have been in the precious metals business for about 15 years now and it's treated me quite well"
6091,I hope to find the course useful
7669,"Hi Jaime I was thinking far to complicated when trying to find the correct answer to this question 
 Actually it's a very simple calculation:   Take your answer from Question 3 and subtract the given share value of 35 USD from it and you're done  _smiley_"
4764,"The multiple-based valuation methodology is more difficult to apply for private companies, start-up companies, biotech firms and companies that experienced losses"
8812,Relatively small part in gold
7426,1year of expense to survive
1210,"I think that gold standard should be put in place 
 I think that poor countries would not be in position to implement quantitative easing policies as it would be considered as bogus and fraudulent money"
1351,"It would depend on my current situation and strategy 
 If I would be on a long term shot, then I would rather leave a very small portion of the portfolio on gold 
 If I would be close to my retirement, my strategy would be to secure my portfolio, therefore I would increase the amount of it"
149,"The final gold of a government should be to the well-being of their citizens 
 By taking such measure the economy reactivates and with that the citizens might be in a better position 
 Having said that, governments should point the responsibles and take the measures to correct the whatever causes the subprime crisis"
1226,"What you calculated is the value of the firm, what you need to calculate is the terminal value, which is completely different thing, you can check its formula at point 2:30 of the second video 
 Hope this helps"
7079,Thanks so much
5130,"To valuate a company using ratios of comparable enterprises we have to assume that comparable companies have similar growth rates, returns on investments, operating margins and are operating in the same region 
 Using such a approach have many limitations 
 Even firms in the same industry can have very different capital structures, risk levels, and growth rates, all of which affect ratios 
 In my opinion, comparison of a company's ratio with industry peers ratios should not be the only factor on which we decide to buy or sell stocks 
 A company could have negative earnings for a lot of reasons 
 The company could just be a bad company and could have had a one time occurrence that just affected the earnings 
 That's why we shouldn't  valuate a company using only ratios 
 DCF method is much better to value companies with negative earnings however is quite complex"
4129,"Some companies rise to absurd valuation multiples like several hundred times earnings 
 But we or others buy them as their rise seems unstoppable 
 Certainly not sensible as it can only be a matter of time before the rush for the door begins"
5479,They need regulations similar to the Canadian banks
6776,"Any rational portfolio should have at least, 5% of their money in gold"
387,"I'm Claire and from China, have fun"
3962,"If the goal of TARP is to motivate banks lending money to real economy, then central banks could step in into money lending business, which would make QE a less important event for the economy"
5794,"Is is truth 
 Cause otherwise is really bad  
  especially for the people who paid "
6866,Why equity volatility cancels out the currency volatility in the long term for EM's
2554,"I largely agree with Dave 
 The videos are also too long, generally 
 An online course should use the digital tools to its advantage 
 It should not be an online version of a classroom course"
1755,"Hi Tom, Welcome to the course and congrats on your MBA! I hope you you are enjoying the course so far. Best regards, Jonas"
5815,"That the market as a whole is fairly valued 
 The pre-2000 internet bubble-burst, where P/E of Internet stocks were extremely high, without proper fundamentals and any realistic hope of future earnings to justify their share prices, is (obviously because retrospectively) a time I wouldn't have felt comfortable using P/E to value companies 
 Companies reporting a loss is a different matter 
 This requires analyzing the causes for this loss, whether it's likely to be a one-time occurrence, due to temporary macro conditions."
5866,"I will invest around 45% of my investment portfolio in gold so that I can hedge against unlikely events and high inflation rates 
 However, I will take the risk of 55% because they reward for my invested capital and enhance living standard"
5363,I would have something around 10% of my portfolio invested on gold
7661,"The assumptions are that the future is going to be like the past, but it is risky, as sometimes companies crash in a very short time, like during 1939, 2001 or 2008 with Lemman Brothers"
6346,"Hi Chaturaka Gunatilaka, I've just been appointed as a mentor 
 I'd like to know if you've got the pdf and slides the student was asking 
 I have some, or all of them 
 Let me know if you still want them 
 Thank you"
8531,"The percentage of gold in my portfolio will form a relatively small part, compare to equities and bonds"
4416,"I would put a relatively small amount of gold in my portfolio 
 I would put a much larger percent of my portfolio into asset classes that are a little riskier than gold but not as risky as equities"
4346,"The P/E of competitor may not truly reflect the operational success in their product 
 Maybe a sideline brought the competitor a different P/E of this period, then you use the wrong indicator to do the multiplication"
4762,"Sometimes it is difficult to find comparable companies in the same industry, stage of their growth as well as similar financing 
 Also, if you use PE ratio, this assumes positive earnings 
 For companies that reported loss it is more suitable to use other ratios, such as Price to Book Value for example"
8133,"I have just taken this quiz, yet I am wondering about question 7 
 We are given a P/E ratio for comparable companies of 9 with earnings for XYZ of 400 MUSD 
 According to the lectures, in order to compute the estimated price per share, we should compute 400*9 = 3600 MUSD 
 But before diving by the number of shared outstanding, we should first subtract debt, right 
 That would yield 3600 - 1000 = 2600 MUSD leaving a price per share of 26 USD/share 
 YET the quiz takes 26 USD/share to be wrong 
 What am I missing"
1214,"Hello everyone my name is Erica Alvarado, I live in Houston, TX I am the first to attend a university 
 I have always dreamed of Becoming an investor as Paritosh Kulkarni 
 I am 27 years i have done some los risk investments"
4896,"Great question 
 I believe in this case one had to measure 
 It begs the questions;    Had the US government not bailed out the banks, how slow would the recovery had been, if there would have been a recovery at all?    What has the bailing achieved 
 Was there an alternative that could have provided the same or better result 
 For me I take it as a necessary evil because the US and the dollar are often used for bench marking and therefore their performance affects the world economy 
 The next step for me is asking, what policies and regulations by governments and other regulatory bodies have been formulated to guard against devastation such as the subprime crisis"
2922,"The assumption that we make when using ratios we observe on the market is that the 'comparable"" companies, or, in general, the area in which these companies are operating, are/is fairly priced 
 As an example, during the tech bubble, the technology sphere, and hence the companies operating n that sphere were highly overvalued, and the multiples-based valuation method would result in an equally overvalued prediction"
2454,"When I first read the discussion and without doing any research I thought about 20% for a large investor and about 5-10% for a small investor 
 I don't really have experience in investing etc. but I thought that people seek more insurance when dealing and investing with a large amount of money than the ones with small 
 After reading a lit bit around the subject peoples opinions tend to be that since gold's main purpose is an insurance policy and it just site there, on average an investors should allocate approximately 10% of his/her portfolio in gold"
8932,"Relatively small part 
 Insurance for catastrophic event"
2209,Not worth to invest to
2452,"I would manage the amount of gold in my portfolio inversely to the expected inflation of my base currency 
 In addition, I would tend to go into gold on economic turbulences to weather out the storm"
2861,I think so
5053,"Im more worried about the bailout itself 
 Have they not transferred problems into the future 
 Its not that these problems have been eliminated."
7973,"I just finished 4/5  i cant find capstone project 
 But i saw that was investors course i enrolled 
 I very confused 
 I sign up for the specialisation with capstone 
 I cant afford to pay another usd 399"
3986,"I would have a relatively large part of my portfolio invested in Gold (maximum 20%) not only as an insurance for a black swan event but also because its value have been increasing over the years unlike currencies which fluctuates from time to time 
 As mentioned in the videos, gold are used as a hedge against inflation, deflation and also against the declining in the dollar value 
 Although these are some critical reasons why persons who are not risk takers should invest a large part of their portfolio in gold, it's not truly my reason for choosing that amount 
 The reason is that gold has preserve its value for thousand of years from way back to 3000 BC and the value has been increasing steadily ever since due to the increasing demand over these years 
 Gold has become part of cultures and traditions for some countries which leads to its demand, and an increase in demand always lead to an increase in price"
5944,"I think it was necessary for the well being of the economy however I also think some incentives or aids to help the well being of the consumer should have been administered 
 The banks benefited from the bailout and certainly helped the psychological aspect that Jane Doe's bank couldn't go bust 
 But I'm not sure the benefits trickled down to help Jane Doe pay her bills or get a mortgage etc"
3361,"Because earning can be manipulated, also extraordinary items can skew earning, non recurring can influence earnings as well"
1639,"Two assumptions that have to be made: 1) That one company performs exactly as the other company's 
 The multiple chosen would be the multiple from the nearest competitor 
 2) That the industry's average is representable enough for the firms in the industry 
 This again has a sub-assumption that all of these companies in this industries perform exactly as the average 
 However, these assumptions can be misleading since nowadays a lot of companies also diversify to increase the possible synergies thus increasing their competitive advantage 
 This might lead to ""incompatibility"" of using the multiples of only one industry 
 Even though they don't diversify, still it's completely misleading to ""generalize"" the companies 
 This thought is even more challenged that companies try to be ahead of its peers (from the same industry) and thus creating significant multiple deviations among them 
 Another robust multiple-based valuation methods is to take an average-over-time multiples of industries or main competitors to avoid the real-time effect of companies that just reported a loss (e.g 
 As occurred now in Oil and Gas sector)"
6422,"Because during bubbles in the market the P/E ration might not give the fair price of companies from the same industry, so this valuation method might give a wrong indication, whereas the DCF method focuses on the company itself and in such a market it gives a better indication regarding the fair market value of company and hence the fairer stock price"
1272,"We assume that the\nvaluation of the companies we are comparing to are correct 
 I would not feel comfortable using\nmultiple-based valuation methods to value companies when there is a certainty\nthat the comparable companies (and probably the original company we are trying\nto evaluate) are part of a bubble"
8025,"Hello Fermin, Can you help me with the outcome of questions 3 and 5 of the second week Quiz, please 
 I have difficulties to solve them 
 Thank you. Rafael Tárrega"
5501,"I am from India 
 In India gold is a good of a status, moreover people do purchase and ornate for festival and family occasions 
 After following this lecture I realised that it can be used as a gadget to hedge risks 
 Hence, a considerable( not a huge) amount can be invested in gold"
8828,A small part like 5%
2223,"We assume that the companies are in a similar stage of development and have a similar financing structure 
 From my point of view the period of  _domain_  bubble is  good example showing that the multiples-based valuation methods do not always work"
5760,"Posted this elsewhere but I emailed support  the start of the course has been delayed,  don't know when it will start"
7601,"Hello Melanie, I'm on week 2 of this course 
 I also am a beginner in finance, I'm in healthcare 
 I'm watching the first video on how much is a company worth and I'm totally lost with the equations 
 Tangy Kincaid"
5809,"I think the main assumption we make is that the external information is accurate and updated 
 We may be comparing a healthy company with one that is about to suffer great losses that haven't yet impacted on their KPIs, for example"
2894,HI I hope to find the course interesting
