msgID,autID,disID,theID,ts,texte
380,360,232,4,2018-06-27 13:47:13,"I think it was important to save the banks as without them, the crisis would have even more lasting consequences for the economy, and it’s recovery would’ve taken a lot longer"
2040,1352,250,4,2018-10-31 14:50:29,"I'm more worried, because I think that unwittingly the Central Banks increasing income inequality"
2917,2143,270,4,2017-06-29 21:01:10,"I would rather have a relatively small part of my portfolio invested in gold, as investments in diversified assets with risk-adjusted return accounted for provide a relatively stable source of revenue which would be otherwise lost, while still maintaining a portfolio with a manageable amount of risk 
 However, enough should be invested in gold to hedge and be able to slowly recover from negative events"
6821,3666,314,4,2018-05-26 19:03:02,"In the short term, companies don't often trade at their fair value"
3241,2310,134,4,2016-02-27 08:31:07,"When we compared we should use high dimensional data, to make sure each of the factor is comparable, in the future we can also basic on the big data and correlation test to find the fit model to compare"
503,470,117,4,2016-06-13 19:58:03,"Truth be told, US FED should have let few financial institutions with bad practices go (bust) and do the right thing for the US economy in long run rather than fixing short-term pains as and when it appears 
 With soaring deficit + debt, post 2007-09 FED policy is just pushing the inevitable financial disaster 
 In Aug-2015, when China's market got hammered, world market including US market got serious hit. This shows that US market is more vulnerable due to lack of strong foundation/ policy"
9151,4231,149,1,2016-06-30 07:00:41,"Yes it was necessary at the time 
 As long as regulations are in place to prevent careless actions in future I don not feel that it creates bad incentives"
4306,2649,149,4,2016-06-24 02:08:34,"If I am an American, I will feel worry about the consequences 
 For example, we can see big insurance company sells very high rate money insurance nowadays 
 People all know, even crisis come, government will ensure the insurance company"
2951,2163,292,4,2016-07-03 18:55:10,Govt Bail out of companies by purchasing ill liquid assets is definitely a good move and has helped the economy to move up
748,449,353,4,2016-09-06 15:05:42,That makes my day better Teresa
5465,776,927,4,2018-10-05 03:40:41,"In the first video the professor mentions an example 
 In that example he says that the investor who made a deposit in the Swiss Bank was denied that money on grounds of his bank going bankrupt 
 Can someone please explain this"
840,762,22,4,2016-02-28 23:48:01,"I would invest a minimum of 15% in a stable Gold Market in my home market or internationally considering the market volatility and growth rate inclusive of the US dollar trend compared to the currency of the invested market 
 Depending on the Global Market trend, economics factors and inflation rate I would go as high as 80% (utmost) in case of/ high probability of market crash or a Black swan event for a quick and safe exit from investments"
567,527,24,4,2016-04-09 14:00:44,"I am more worried about the potential consequences of this bailout, because the phenomenon of "" too big to fail"" has sent a wrong message to the banks who may  cause another even bigger problems in the future 
 On the other hand, it is critical to clean up the bad debt as soon as possible to revive the economy 
 So, it is a dilemma to deal with"
6022,3436,15,4,2016-04-03 07:54:54,"While investor invest his money he should aware of the companies performance to avoid future losses by predicting the risks  involved in their investment portfolio  by computing firms performances  by aware of the company share price (overvalued or Undervalued) and its dividend pay out. the valuation methods given in this module such as, share price calculation, NPV(when it is negative we should not invest) , DCF are useful to investor to make investment decisions"
5082,3099,524,4,2018-10-24 09:00:08,"Considering gold as a hedge, my asset allocation would depend on a lot of factors:    Political Stability domestically and world wide;   My profile as an investor correlated with my age and my amount of wealth;   World economy indicators 
 Currently, in 2018, at the age of 31, I would probably allocate 30% of my assets in gold considering I'm living in Brazil, which is now passing through a change in political ideologies (left to right) after living through a huge crises for the past few years 
 However, if I was 60, my asset allocation in gold would be 70% due to my age and time in history - considering I'm not a conservative nor aggressive investor 
 The world at the moment is also presenting many ""moving parts"" with Trump playing the big boy in the playground looking for a fight with major economies like China and other economies like Italy going through tough tough times and destabilizing the Euro zone 
 Therefore, I would have a good portion of my assets to have gold as a hedge for this moment in history"
5297,3179,134,4,2016-02-26 09:37:08,Each company is unique and it is very hard to make an apple to apple comparison
8901,3022,384,2,2018-04-01 11:58:54,"I’d prefer to have small but leveraged part of my portfolio in hedge position, and the big on one in traditional assets to have more profits in reward with the assurance if something will go wrong"
8418,319,270,2,2017-07-09 04:29:35,Relatively a small part
5060,2893,20,4,2016-08-18 14:43:24,I will hold a relatively smaller part of gold than permanent assets
6568,3592,74,4,2018-08-25 20:51:30,"That these companies have the same constancy in factors such as efficiency of management, dealing with hardship strategies, and privilege over competitors"
7786,569,1050,0,2016-03-19 20:02:01,"Agree, Michel is explaining the best 
 Studing becomes even a pleasure when it is so clear 
 I wish explanations from other would be not so dry and perhaps even longer in duration (not just 5 min)"
1121,974,178,4,2016-05-09 12:44:34,"I think the central banks are doing ok, as you can always create new laws and rules to avoid the banks to be careless with their assets"
2557,62,554,4,2016-02-12 15:57:52,"Jonas I think that's a trillion Dollars dilemma 
 It reminds me my teenager daughter, she repeatedly didn't care about damaging herself playing very fast in a hammock 
 Finally she failed and got hurt: what should I do 
 Taking her immediately to the hospital or letting her arrange by herself, and potentially get the things even more complicated?\n I do agree that the banks will continue taking more risk than they should, but without the TARP, we could have seen the collapse of other financial institutions, potentially leading to a systematic risk for the whole financial system.\n I hope that the new regulations and the learned experience by all the players (banks, regulators, investors and the whole society) minimize the possibility of other financial crisis, at least in the forecast horizon"
2961,489,228,4,2018-04-16 21:00:34,"The main advantage of using gold is a safetenes of nasty unexpected events that may happen 
 The percentage of owning gold in the portfolio time to time may vary depending on investor goals but the small part should remain always 
 Moreover  fast economic growth give additional opportunity to buy this asset at the less undervalued price on the market"
7731,3854,1202,0,2017-07-21 02:21:45,"Towards the end of the first video (1:50) on ""Basic concepts in finance"", it seems to me that the lecturers engage in an ""error"" that we were warned against earlier in the course - not to add return percentages 
 Granted, their point was that one needed to look at the whole picture instead of just the last return, but comparing the arithmetic averages of the return seems misleading to me (especially after the earlier videos on common mistakes people make) 
  It seems to me that the average return should be computed as follows:  Stock A: ( (1 + 1%) * (1 + 1%) * (1 + 13%))^(1/3) - 1 = 4.85% Stock B: ((1 + 13%) * (1+3%) * (1 + 2%))^(1/3) - 1 = 5.89%"
1250,1067,472,4,2018-09-29 11:44:01,"The assumption is a certain ratio is applicable and can be interpreted across different companies 
 Back in 1998, when Kmart's share price was downtrodden, it became a favorite of some investors 
 Those Kmart investors failed to see that the business's model was fundamentally flawed, the company's earnings continued to fall and went bankruptcy in 2002 
 P/E ratio can be artificially impacted by a change in capital structure 
 The way we deal with negative earnings will depend upon hy the firm has negative earnings in the first place"
116,92,97,4,2016-07-27 21:40:38,"I would rather invest a small portion into gold, as my investment horizon is long 
 This means that the bad returns from extreme events should smooth out in the long run.\n"
1127,979,63,4,2017-06-25 07:24:35,"Comparable companies: different markets, geographies, life cycles, business models, management 
 Capital structure, account rules,historical information 
 We need a very prepared team"
8980,3808,167,2,2016-09-19 15:01:32,"Relatively small part, but be ready to increase the proportion as stocks are sold off in a downturn in stock market"
7192,33,32,3,2016-06-25 18:00:24,"Hi Ioannis, I totally agree with you  
   Mastering Micro and Macro Economics + Accounting (or at least ( Financial Accounting) is very important if you want to master Finance (both Corporate and Investments) 
  We are lucky because we can find great courses for all of this on Coursera, and it is why Coursera is wonderful  _smiley_  All the best, Jan"
7736,3303,596,0,2016-07-14 12:57:30,"\n\nSo initially, in January 2015, you needed 150 yen to buy one euro, and at the end of the year, you need just over 140 yens to buy one euro, so the yen has weakened  is yen weekend or strengthened in above case\n"
5752,3346,944,4,2017-07-21 03:18:07,"I m akshita singhal from India 
 I am very much excited for the module 
 Hope to learn new things"
6208,3486,59,4,2016-04-21 12:16:06,"I think it depends on the economic situation of the country and inflation, if you need to cash in the short term , epends on how many other conservative investments are already included in your savings mix. If you already own conservative assets such as farmland, bonds of countries with low debt and a trade surplus, dividend-paying stocks of utility companies with proven long-term profitability  
  that mean you will requir less gold to shield you from market turbulence"
3760,2577,178,4,2016-05-05 00:56:26,"I am worried that its a bad incentive 
 Some other means should have been taken to fail the banks that mismanaged their individual risk while also preventing systemic risk from occurring 
 Banks, lets not forget, are in the business of risk management - it is a large part of their business model 
 If they fail at this then its game over 
 Market forces and capitalism were not allowed to assert its hand, and In this case was circumvented (capitalism on the way up and socialism on the way down) 
   Also let's not lose sight that since 2008 banks have become bigger and, possibly, more concentrated 
 Just my thoughts"
3802,2598,240,4,2017-08-12 16:58:13,"I would not invest in gold, as real estate has no correlation with other asset and can be used to diversify"
7575,1423,13,0,2016-03-25 01:13:49,"Actually, they sold Gold concessions for just 5000 USD in 2011  _smiley_ ) but the issue is that they have a law that oblige investors to give away 51% to a local with the risk of being kicked out anytime 
 A lot of Israelis are there investing in Chromium Mines and Diamonds 
 Africa has resources, but they do not have an economy 
 Still I can't understand how the Zimbabwean inflation went to bad"
758,694,20,4,2016-08-27 15:12:49,"I consider as a beginner investor, I will start with a 40-45% of my total investment portfolio in gold, and as I feel and become more comfortable and trusted in my own skills, I would start to increase the tenancy of more risky assets 
 Nevertheless I believe that I would always have a minimum of 20-25% of my portfolio invested in gold"
9176,4235,99,1,2016-08-27 17:35:56,"Yes 
 Bad incentives to banks"
7245,1242,40,3,2016-10-03 21:18:55,"Hy,  I am Olivier and I come from Belgium 
 I am also glad to start this course 
 Il hope we will learn a lot and have fun"
7470,1422,106,0,2018-10-05 13:39:23,"Benefit is 44 
 352/1.11+385/1.23+407/1.36+6047/1.36 =5376 5376-1000=4376 4376/100=43.76(approx=44) is i hv to take 43.76 as 43"
5538,3257,16,4,2018-02-26 04:02:38,"I rather have a considerable amount of gold in my portfolio, roughly 20%"
7539,3811,153,0,2016-03-05 07:01:39,"5-10% if your goal is to build up wealth, 15-20% if you are trying to preserve its value"
2293,1141,146,4,2018-10-30 15:00:25,"I agree 
 Maybe even an average of the two would be a possibility"
6401,3545,77,4,2016-07-31 11:52:37,Simply necessary for well being of economy
6647,2105,18,4,2016-02-21 10:09:50,"We assume all the companies are generating some profit  in a relatively stable environment (same growth prospects for the industry) 
  In period of economic crises and downturn, for many cyclical companies survival is at stake, some companies make losses while the benefits of others fall down, and  how they recover from the downturn may significantly depend on the strategy followed: for instance during the economic crisis for banks, or now for oil companies with the oil crisis or raw materials companies (eg Eramet)"
1978,1585,124,4,2016-08-17 09:51:36,"Clear and effective guidance and regulation was not in place, TARP was a knee-jerk reaction to a caotic situation 
 The large debt left over by printing cash through monetary easing will be a legacy that will take many decades to fix"
5530,2299,22,4,2016-02-16 18:24:30,"Diversification is a good way to avoid big losses of one asset 
 So having a portion of gold in a portfolio would be a good way of ensuring the diversification 
 I would probably allocate a small potion in CALL options of a gold ETF in order to hedge against black swans and to reduce the opportunity cost of having a big part of the portfolio invested in gold"
3466,2065,752,4,2016-02-16 07:48:43,I'm not here just to pass the tests
4871,721,14,4,2016-12-11 03:27:06,"Disregarding storage I would have a reasonable proportion in gold for a long term investment 
 Mainly due to my inability to grasp the likelihood of asset management companies breaking down and then rebuilding companies for profit due to money moving but not profit for the company 
 I can understand at a basic level the making of money from shifting paper (online) but I cannot see the flow of wealth to the everyday investors 
 Because of some internal rejection of it based on naive morality or similar I know that i have barriers to making full use of shares, stocks etc. That is why i am doing this course 
 To move beyond disrespect to understanding"
8914,4165,105,2,2018-08-13 10:49:57,I would invest a relatively small percentage of my portfolio in gold as part of a diversified investment strategy
2583,180,150,4,2016-03-27 15:38:38,"Gold should only be a small part of the portfolio, perhaps 5-10% 
  Any more than that can cause large opportunity costs 
 It is true we need to be cautious about possible black swan events or other disturbances in the markets, but it is also important to keep in mind that these do not occur frequently 
 Thus, keeping gold is important, however keeping gold as the majority in our portfolio is not advised"
6241,3500,19,4,2016-04-27 09:59:10,"If we want to see the bigger picture, our main objective coming out from the recession is to stimulate growth -not punishing the banks-, therefore, what was done by the US is justified"
5109,104,34,4,2016-03-20 04:34:58,"Simply said it enables Top level society living on bankers credit and consuming labor to live themselves off lower labor / wage earners real efforts- I think representatives of such Governments are committing treason on ethical grounds - it is common sense that any Economy or Economic Policy should reflect a ethical exchange of ""real values"" within Society and not to perpetuate status-co with such bail outs even though they might  be correct within the bounds of a synthetic short-term  economic stabilization"
3620,1325,218,4,2016-06-23 01:06:00,"I would rather have a relatively small part of my portfolio invested in gold and stomach the impact that extreme events may have on traditional assets 
 For the majority of the time, investing properly in a variety of stocks and bonds will yield higher gains than that of gold 
 Having a small amount of one's portfolio in gold will only slightly diminish the impacts of extreme events; however, these extreme events are able to serve as an opportunity to buy investments at a low price 
 This ability to buy during an extreme events is made more difficult if there is not enough cash on hand due to excessive investments on gold"
7633,89,938,0,2016-02-27 00:17:25,It will be nice if anyone can explain if the shorted stock volatility is modified by multiplying it's values by -1 or if it requires a somewhat more complex adjustment
570,530,62,4,2018-08-02 12:58:51,"On the one hand it was simply necessary to save a complex structure from a complete collapse 
 On the other hand, banks are under constant investigation nowadays due to the financial crisis, so they should not be able to invest carelessly"
4578,1449,259,4,2018-08-18 04:55:37,Likelihood of another crisis in future if it’s not managed well the plan
1241,1059,287,4,2018-02-24 04:17:41,"In the developed markets the economy is controlled more by the private banks and the investors than central banks and the government comparing to emerging markets such as China and even India 
 Even though it easy to say that the government is giving the wrong incentives to the private banks but it is clearly doing what it can which is only controlling and performing their side of the bargain, a level regulations need to be introduced when the government is giving incentive the banks need to be held accountable to clear plans to what they intend to do with the money 
 Easy said than done"
7810,179,984,0,2016-06-24 06:16:31,"Hi, Chaturaka, I have 2 things to tell you. 
 .I cannot contact you so I post them here 
 The slides are avaliable, at least in my Coursera APP.   I have to prepare for an exam, so there will be 2 weeks I won`t be here 
 I`m really sorry to let you reply all the posts 
 Good luck~ Racheal"
7427,104,639,0,2016-03-25 20:39:23,"I guess it should commence on or after 28,March/2016 - It says it commences in March/2016"
4614,2929,99,4,2016-09-16 04:06:51,"I think it was necessary because the US economy was very bad and it was going to stay the same way more year if Central Bank haven't made the TARP 
 And i don't think that make banks careless about their investment activity, as they were some banks that went to bankrupt (like Lehman Brothers) and the government didn't save them, so the banks need to have control over their investments"
6511,1561,33,4,2017-07-15 14:39:41,"When we use PE ratio, we assume the following; - the participants of our comparable peer set; they may not be an exact match for our Company  
  They may not be in the same stage of development as our company is 
 They may not have the same financial risk as our company 
 This assumption is crucial when we make a peer set.  When the price is of a company is not being traded at the Stock Exchange on rational basis, or rather on pure sentiment, the PE multiple derived may not represent the true picture and thus this may result in an overestimated valuation 
 One needs to see the logical reasons to understand that if a company is being traded at a higher/Lower  multiple than in other times what is making the price soar/ down 
 If a Company reported a negative earning, one should see the cause of the negative earning and check whether there were any extraordinary losses or expenses 
 For Valuation, one could pick up other earning form such as EBITDA or PBT"
5510,1401,328,4,2017-09-23 15:45:18,"I think that this was a necessary step as not stepping in could have had even worse consequences, and that the increasing regulatory pressure helps avoiding bad incentives"
3437,707,421,4,2016-02-09 19:39:50,"Earning are the company's net income from selling cars or, in the instructors example, a collection of stocks 
 The stock price is what you pay to buy a stock 
 It is not a measure of a company's true worth or true value by itself 
 When you buy a stock you are buying a share of the company's future earnings 
 You can pay a lot for those future earnings (buy when the PE ratio is high) or you can pay less for those earnings (buy when the PE ratio is lower) 
   Note: The instructor's example is about the market's PE ratio, not individual companies"
7754,1974,1005,0,2016-02-17 12:24:40,"Yes I did with the calculator, just input this parenthesis  for the numerator and denominator and it should work 
 I think the answer for the  VN for the Q2 is 6.067. 
  then we need to calculate the V0 
 I dont have my notebook here, I already calculated both"
1576,1319,210,4,2018-05-05 04:15:20,"Even though the policy followed by the US government seems very dangerous, it was necessary to protect the economy from totally reducing to dust 
 Now, it may seem like that the US government is incentivising banks to lend money indiscriminately, but this control comes from somewhere else 
 Even though lending has been promoted, they can only do so if they abide by certain regulations of the Securities and Exchange Commission 
 Borrowers need to have good credit ratings and comply with credit requirements 
 Banks cannot lend money to any Jack anymore 
 Therefore, adding regulations may be necessary while trying to stimulate the economy, which the US has done pretty well"
4352,2511,22,4,2016-02-14 11:49:33,"Portion of my portfolio invested in gold would rather depend upon tactical allocation of my portfolio 
 Higher the investment in EM or riskier markets more be part of gold in portfolio 
 Basically, the optimum investment in gold would be enough of the cover to hedge against the risk pertaining to my portfolio which would ultimately depend upon the degree of correlation between gold prices and other assest in portfolio"
6069,3377,431,4,2017-09-13 08:48:15,"I think the costs of letting a bank fail is far too high and since it is often borne parties other than the collapsing bank itself, bailouts are necessary to prevent the fail of one bank to lead to serious damage in the economy 
 Banks are fundamental to the financial system as well as the economy 
 Their business largely depends on the trust of investors and depositors 
 Thus, in times of financial turbulence, if the depositors lose trust and believe a bank is on the verge of bankruptcy, the risk of a potential bank run is high 
 Also it could lead to mistrust among the banks and the interbank financial system could freeze as we see in the 2008/09 crisis 
 A freeze will raise serious problems for banks since a main function of a bank is to transform short term debt to long term credit 
 This maturity transformation could be seriously impaired in times of soaring or even unavailable interbank lending 
 In short, even though there are compelling arguments for NOT bailing out banks, e.g 
 The belief of ""too-big-too-fail"" could generate high incentive for banks to be careless in future and give out more subprime loans, I believe it is necessary for government to give guarantees to potentially failing banks in order to ensure the trust of depositors and investors, as well as to prevent large spillover of the damage from one bank to others"
1314,1117,369,4,2017-07-27 01:59:44,"I typically would not have a large holding in gold 
 To profit from gold you need to buy and sell at the appropriate time 
 Historically it does not continue an upward path and is a drag on my small portfolio 
 I would rather move some equity to cash or hold a bit more cash than hold on to gold"
1403,1190,497,4,2017-02-07 21:25:07,"We assume that the comparable\nfirms have a similar financing structure as the firm we are trying to value (because of financial leverage) 
  Besides that, it's also important that the comparable firms operate in the same industry so that they have the same operating risk ànd it's important that they face a similar stage op development so that we can assume the same expected growth rates"
7337,3714,353,3,2016-03-07 17:28:34,"Thanks Samer, I'm just trying to understand the process and how they got there 
 That's why I dont use excel just a calculator 
 I wished they have more examples for me to compare their computations"
713,658,34,4,2016-03-10 10:04:25,"In my opinion, the US govt 
 Did a required job to let the economy role and revive while getting a good lesson of collective madness and manipulation 
 Though it was questionable for many reasons, it prevented many more institutions and households from default 
 Investors' deposits were saved, business borrowers could fund and roll their businesses 
 The fat cats were saved for the sake of saving the people who were victims of the vicious scheme"
4159,1013,85,4,2017-07-10 03:36:45,"We would assume that companies are in the same industry, so they would have the same operating risk, and we would also assume that they are in the similar stage of development, so they have similar growth rate 
 Finally, when we using P/E, we should also in addition to make sure that the companies have the similar financial structure"
9016,36,98,1,2016-11-13 20:37:45,"Yes, it was necessary to bail out banks or else the repercussions on Main street would have been larger than what would have happened on Wall Street"
