msgID,autID,disID,theID,ts,texte
1483,433,188,4,2017-09-15 16:17:00,"We assume that the market price of other companies is fair and that the market is pricing the companies correctly 
 In case of a bubble, the price of one company might be well above its fair value 
 This, in turn, would further increase the price of similar companies in a positive feedback loop that leads to the bubble 
 The price of a company is a long-term value that is not fully represented by one single financial statement 
 Hence, if a company reports a loss this year, the market value calculated using the multiple methods would not be affected"
5803,1312,128,4,2017-11-20 15:30:53,"It really depends on the current economical climate as well as the risk aversion level of th invested 
 In addition, it will also depend on the age group of the investor 
 Generally speaking, younger age group investors will not hold as much gold relative to the older age group as they are to stomach more risk 
 Hence, the answer depends on the individual needs and current economic climate"
6911,219,22,4,2016-02-27 14:58:51,"In my opinion, investing in paper gold (ie gold ETFs, mining stocks etc) should be an important part of portfolio management but alongside the general asset allocation in that portfolio 
 This means used as a hedge in bigger percentages when a bear market is expected and smaller percentages when a bull market is expected 
 As far as physical gold is concerned, I wouldn't invest more than 5-10% of the overall portfolio due to technical issues like scarcity of bullion, difficulty to sell at a good price, insurance fees, fear of government confiscation in times of turmoil etc"
1686,358,153,4,2016-03-13 12:49:34,Variable amount depending on market conditions
2715,2024,159,4,2017-09-17 23:52:49,"The main assumption would be that the P/E ratio of the companies is same which would not be the case 
 Since I haven't traded personally in stocks there is no particular incident which i have encountered this situation 
 Also apart from the P/E ratio, other ratios cannot accurately predict the financial health of two comparable companies"
895,707,22,4,2016-02-09 19:37:42,"If I had bought an ounce of gold 2000 years ago, it would only be worth $1200 today 
 That would be a very minuscule ROI. During that time, my gold paid no interest or dividends and I would have had to store it and protect for 2000 years 
 Why would I expect gold to perform any better over my investing lifetime 
 In the US, a small investor is going to pay high transaction costs to buy and sell physical gold 
 They may have to pay state sales tax on the purchase 
 In the US,  physical gold is taxed as a collectible, so the investor will likely owe more tax on any gain compared to an equity or bond investment"
4722,2975,145,4,2016-03-04 14:16:48,Worried
5640,740,390,4,2018-11-13 18:21:39,The US government bailout was necessary to prevent a crisis similar to the Great Recession of the 1930s
5888,3392,12,4,2017-11-11 13:55:50,"The assumption is that the ratio across companies is the same 
 During the dot com crisis and the suprime crisis you would not feel comfortable because the market was so volatile 
 For companies with negative earnings the P/E ratio is not applicable"
3739,56,624,4,2017-10-30 04:35:35,"Personally, In my portfolio, I would invest 15%-20% of my total money to be gold and platinum 
 Mainly because our new president increase political tensions with other country, and there's a lot political related bad news about European country (I have expectation that some western country would go through debt or credit crisis in recent year.) Liya Cen"
4022,1364,604,4,2018-05-25 16:17:32,"A varying level of engagement, but some stable"
6148,1603,110,4,2017-10-17 20:34:27,"While using ratios to reach the fair value of a company, we should be aware if the financial and operational risks from companies that we’re choosing are equal to the one we’re valuing"
5836,3375,150,4,2016-03-18 13:19:39,"I would overall prefer to have a small part of my portfolio invested in gold as a hedge against potential risk of the overall portfolio 
 However, as an investor increases in age and risk tolerances change I would consider increasing that  percentage slightly over time as the overall portfolio becomes more and more conservative"
3998,2673,48,4,2018-02-04 10:09:32,"We assume that the companies in the market are at fair value, that is the market or the sector overall is not over valued or undervalued"
4437,1413,249,4,2017-02-12 09:19:32,"I suppose there is a risk when there is a bubble in the market 
 As companies in these situations are over-valued, comparing ratios would not make sense"
7519,1118,1179,0,2017-04-02 19:57:43,"After reviewing the lecture, and the formula, I realize that the 9.91 is actually the amount by which the initial investment of $150 is exceeded 
 Understood"
8439,3525,22,2,2016-02-17 15:12:15,"I would opt for a relatively small part, looking at it as a foundation for a house -- a place to rebuild if, say, a tornado wipes out the house"
7951,2983,36,0,2016-04-01 02:06:35,"Depends on your risk tolerance and objectives 
 Personally I would only buy gold if there is a foreseen reason to do so, but with that being said I prefer very active management 
 I think a large portion of your portfolio in gold isn't prudent, as it's price fluctuates and in the case of a stable or positive trending market for a long time its value may drop significantly 
 Example, in the past 10 years it went up to $2000 roughly, then back down to $1000, a 50% loss if realized 
 Your better off buying puts in times of uncertainty"
2477,1891,215,4,2018-02-22 23:32:08,"Same types of companies does not always ensure same skilled workforce and future innovation 
 As example, yahoo and google are same types of companies 
 But yahoo got left behind as google showed more innovation and seized the market"
5739,3342,134,4,2016-03-05 20:50:53,"When we use multiples method, we assume that two companies have similar marketing strategy, same Quality of management etc which is possibly erroneous 
 During a time of a financial crises (like the sub-prime crises of 2007 or earlier), I would not have felt comfortable using the multiples-based valuation methods 
 During this time we may have what is known as a 'stock market bubble' 
    No, we should not use 'multiple value' of a company which just reported a loss because that loss may be due to several internal factors within that company which in no way may be related for assessing the value of our company"
2334,1809,356,4,2016-07-12 01:48:39,I would allocate roughly 10% of my portfolio to Gold
4962,3050,178,4,2016-04-27 14:35:57,"Personally, I have mixed feelings about this 
 However, I must stress the fact that I do agree when people and corporations are taking unnecessary risk to generate and accumulate wealth for themselves, they should pay the consequences (High Reward = High Risk) 
  If the government is to provide ""bail-out"" solutions (using the public money), what is the incentive for these people to stop taking the unnecessary risk 
 The problem here is the US government (in this case) is trying to manipulate the mechanism of the ""invisible hand"" by providing exit solutions to those impacted 
 The US government bailout programmes can ultimately cause issues with the National debt level, speed up the next bubble economy, and perhaps from the ethical point of view where inequality is obvious in the US but the government rather spend money to bail out the elite class"
5637,3303,596,4,2016-07-16 11:55:04,"Hi 
 I have a query on hedging currency 
 Can we hedge currency when we are not sure about the returns 
 As how much to hedge 
 There can be over or under hedging 
 And moreover it can just costs us without any benefit 
 \n"
5279,2602,9,4,2016-03-23 10:55:02,"I think it is smarter moved by CB to help banks participate in better way. But at the same time CB should put firm monitoring process of banks, so that they should not take it for granted"
2235,1745,119,4,2016-11-11 13:08:40,"Classic example of short-term gain versus long-term pain, which reminds of the use of fossil fuels and climate change 
 To reduce long-term pain only additional regulation that is effectively enforced can counterbalance these bad incentives"
2756,2045,101,4,2016-01-27 12:53:41,I have been going through the video lectures
1513,1269,138,4,2017-05-08 18:52:51,"1 
  What could that assumption be 
 We assume that there are similar companies that were correctly evaluated by someone else, i.e 
 Company under consideration is not unique \n\n2 
 Were there instances in history where you would not have felt comfortable using multiple-based valuation methods to value companies  It's difficult to use this method when market is rapidly changing because historical data is not relevant in this case 
 Change can be caused by crisis or by some black swan events 
 \n\n3 
 What about companies that just reported a loss (i.e 
 Negative earnings) 
   Such events can be an exception 
 Historical and Peer group data is more important"
7468,29,1172,0,2017-08-28 20:37:07,"HI Oyebola, Sorry you're having problems and hope this response isn't too late 
 I would suggest trying to add a decimal to your answer such as ""2.0"" Let me know if that helps"
287,273,20,4,2016-08-27 19:25:03,I would rather have a small part of my portfolio in Gold for emergency need and put into other investments too
5701,3088,188,4,2017-09-13 16:14:38,"The crucial assumption that Professor Phillip Valta highlighted is that, when using ratios (such as price-to-earnings), comparable firms should have a similar financing structure (financial leverage) 
    Multiple-based valuation methods would be largely redundant in the time of the 2008 global financial crisis as a lot of company stocks would not be trading at fair value 
 Instead, a discounted cashflow method (although complex) may be the best route of valuing a company in times of financial distress"
6513,649,84,4,2016-12-28 16:43:32,"I would hold a small amount only for diversification purposes 
 The percentage of the portfolio that will be in gold depends on the current situation and the evaluation/overview of the market that I have positions in 
 For example if the market looks bearish I might increase the this small percentage of gold 
 For bullish markets the opposite 
 Another idea is to use funds that have positions in gold or metals reducing the costs for holding and storing gold"
8711,3058,167,2,2016-08-25 16:05:35,Relatively small to avoid missing opportunities
1939,1561,5,4,2017-07-27 14:51:08,"It depends on what one thinks it was supposed to help 
 It's aim was to avoid the economic catastrophe and ease the pressure on financial institutions"
3905,1294,171,4,2016-08-08 18:21:25,"Golden rule for how much to invest into Gold could be the share of Gold market value against other markets' global value, so let´s say around 10-20% of our portfolio would be gold"
8803,2729,153,2,2016-03-14 05:44:01,Small part of portfolio
2366,215,247,4,2017-11-12 10:24:04,"There are many occasions when multiple based valuation wouldn't be appropriate 
 For an example such an instances may include: (a) in case of valuation of a startup company that hasn't generated any cash income yet. (b) expectations of Price and Capital returns doesn't always go in the same direction or with the same pace 
 (c) P/E ratio might misleading based on how that ratio is obtained 
 For an example: if a company holds a lot of excess cash, which generate little or no income, that ratio may show an artificially inflated value 
 Therefore all non-operating assets must be excluded in obtaining the ratio 
 (d) multiple based valuation based on industry averages doesn't take into account that different companies, although in the same industry, may have different growth expectations based on the value they create"
2611,1342,275,4,2016-05-05 06:46:33,I would still rather hold a small part of my portfolio in gold
2445,1016,48,4,2018-01-20 16:46:10,"When we use ratios we assume that the todays ratios are representative future situation of the company 
 I would have not been comfortable using multiple-based valuation in a scenario of stock bubble 
 In a situation of negative earning, the P/E ratio for instance is not usable"
1232,1052,467,4,2017-12-01 18:43:47,"There are several issues with using a single-point-in-time ratio like P/E 
 Like the prompt suggests, it would make a company that had one bad quarter of earnings for e.g 
 One-time charges look very poor, or cyclical companies as well 
 It also doesn't take into account macroeconomic conditions that affect the whole market"
8705,711,402,2,2017-08-24 18:13:04,Small part
5066,1116,591,4,2017-12-10 16:39:26,"It might have been the need of the hour for the US Government to bail out their banks by means of the TARP programme 
 On one hand we have witnessed a steady recovery of the US economy post the sub prime crisis unlike the euro zone which is still experiencing a very slow economic growth for which we should give due credit to the Feds 
 On the other hand it can certainly be argued that this action of the central bank does not reflect good about its policies of properly incentivizing its banks but the fact that they have been able to avoid another great depression in the US (albeit by means of unconventional policies that include quantitative easing)  it can well be said that a major economic disaster to the world has been averted"
7553,62,535,0,2016-02-03 23:27:44,"I sent a message to Phoebe, and just received this reply:  Phoebe Malcolm (Coursera) \n   3 de fev 14:27 \n   Hi Abelardo,\n   Thank you for pointing this out. There is a bug on the site which we are working on fixing now. I will be in touch when it is solved.\n   Thank you again.\n   Phoebe\n"
3315,2344,300,4,2018-06-09 07:27:04,"I think the question is purely subjective and depends on the risk taking capability of the investor 
 If someone is near to their retirement then it makes sense to have a relatively large part of their portfolio invested in gold or else if someone is in their early twenties and are willing to take the impact of extreme events then they can have a relatively smaller part of their portfolio invested in gold"
5556,377,18,4,2016-02-15 06:47:20,"There are several factors that influence valuation: macroeconomics, policy decisions, market valuation, technical factors 
 All of these together have an impact on the valuation of a company 
 DCF or multiple-based valuation focus on the companies itself 
 So when using multiple-based valuation we are assuming that the market is not going to change 
 Now coming to the company itself, when using multiple-based valuation method we are assuming that companies are comparable, meaning that they are in the same industry (have the same operating risk), are in the same development stage (have the same expected growth rate), they have similar financial risk and above all that they have similar management quality, similar competitive advantages 
 Same short term dynamics 
 Although I am not an investor, I wouldn't be comfortable using this method during a ""bubble""/market crashes as this would have a huge impact to the notion of comparable companies 
 When a company reports a loss instead of using the P/E multiple you can choose another multiple"
6107,2083,321,4,2016-12-13 04:49:46,"I am more worried about the potential consequences of the bailout in terms of bad incentives for banks because the banks could do reckless decisions knowing the government could provide them for their bailout 
 In effect, the projects of the government on priority would not meet its due timeline or the taxes of the people will only be wasted because of the reckless decision of the bank on their activities"
183,176,133,4,2017-07-21 03:04:15,"Hi Everyone,  I live in Houston, Texas and I am so excited to start this new course 
 Investment always has been a black box to me 
 It is a bit ambiguous and uncertain but I am willing to try to get the most out this class 
 See you around"
8201,3777,18,0,2016-02-25 09:01:22,"Hello Ann Marie, Can you help me with the outcome of questions 3 and 5 of the second week Quiz, please 
 I have difficulties to solve them 
 Thank you. Rafael Tárrega"
4898,2310,884,4,2017-07-21 02:32:07,We should better calculated the expectation of this distribution
2256,728,27,4,2017-02-09 08:52:49,"That assumption made when we use ratios we observe on the market to value other comparable companies is that the market is valuing those comparable companies fairly 
 During the dot-com bubble, I would not have felt comfortable using multiple-based valuation methods to value companies"
3022,1694,178,4,2016-05-17 11:30:34,The financial sector did well out of TARP at the expense of the tax payer
5488,1278,275,4,2016-05-01 21:46:12,"It depends upon the person 
 Since  I came from quite volatile country, I would be cautious and have a decent amount of gold"
103,101,85,4,2017-07-01 08:49:58,Choice of multiples can be subjective.\n Difficult to find comparables with identical or at least similar revenue drivers.\n Assumption that market accurately values the peer group
6705,3642,159,4,2017-09-17 21:33:05,"A key assumption is that the companies you compare to are themselves at fair value 
 Companies in the same sector may as a group be over- or undervalued e.g 
 Tech bubble where technology and telecoms firms became over valued 
 Using this approach, you would have likely calculated that a particular tech firm was approximately fair value, when in fact the sector as a whole was massively over valued 
 When there is a large amount of speculation in a particular sector about future growth, the results of this method should therefore be taken with caution 
 \nUsing negative earnings in this method gives a negative fair value, which is illogical given a firm has limited liabilities, thus can not loose an investor more than what they invest, making the minimum firm value zero 
 \n\n This method also assumes that revenues or EBITDA are representative of the overall performance of the business 
 There may be large one-off large costs (e.g 
 Restructuring, fines) or one-off sources of revenues (e.g 
 Sale of a division of the firm) which affect headline profits while underlying profits which is more representative of long-term outlook give a different picture of relative performance compared to its peers 
 An unexpected change in macroeconomic conditions (e.g 
 Sudden recession) will also affect fair value, not taken into account when looking at past profits"
2095,1654,343,4,2018-02-02 22:34:32,"I would say leverage of the other companies would play a factor in the assumption, other companies may have more of a financial leverage than XYZ"
5249,3034,562,4,2017-01-27 15:19:53,"In essence I would hold gold as the ultimate Black Swan hedge 
 That means, keeping as much gold handy (in small denominations, such as gold coins) as is necessary in a worst case scenario to leave my resident country and pay my way into safety (wherever that is), allowing  also for some capital to start a new life 
 In absolute terms for my personal circumstances that would be equivalent to about EUR 30.000 in gold"
8719,3526,113,2,2018-01-06 18:56:16,Small portion for absolute essentials
1847,1502,116,4,2016-06-21 11:47:06,"\n\n\n    What could that assumption be 
 The assumption is that all peer companies should be valued at a similar level 
 If there were to be an asset overvaluation, this would inflate horizontally to all companies in this asset class (i.e 
 The valuation peers)      Were there instances in history where you would not have felt comfortable using multiple-based valuation methods to value companies 
 Emerging markets (almost any time), periods of asset inflation (now, pre-2008, 1999 etc.)\n    What about companies that just reported a loss (i.e 
 Negative earnings) 
  Not use multiples valuation or change multiples (i.e 
 For real estate negative earnings means almost nothing) 
 \n"
7520,3807,350,0,2017-06-01 00:20:42,I think 5 - 10% is prudent right now
8382,3984,340,2,2018-08-07 04:07:15,Na
3827,2607,240,4,2017-08-17 20:18:42,"I would own no up to 5% gold in my portfolio 
 But it all starts with the amount of risk I am willing to take"
6953,2211,15,4,2016-03-25 12:11:45,"It may be difficult to use the comparable multiples method if the industry is totally new and if it is difficult to find similar pure-play companies 
 In certain cases different multiples may also apply for companies in different countries 
 For negative earnings, we could use multiples such as Price / Sales 
 Further analysis needs to go into why negative earnings exists (long term issue, temporary issue, cyclical), and further valuation adjustments should be done to accurately value the equity"
818,744,373,4,2017-01-08 18:45:24,"The principle assumption we make when using ratios observed in the market to value a company is that the market is pricing the company correctly - i.e 
 It is acting irrationally 
 It is clear that there are times when this does not happen 
 For example, I would be uncomfortable relying on multiple-based valuation methods when valuing technology stocks in 1999 or 2000 at the height of the dot com bubble 
 Indeed, it is impossible to use earning ratios to value a company which has reported a loss"
3497,2446,500,4,2018-08-30 09:33:01,"Because in Europe we also have had a good economic growth in the past decade, maybe not as good as the US but still 
 They should have done it without this bailout which sends just a bad signal to a market who is already careless"
5130,2133,426,4,2018-03-06 16:01:44,"To valuate a company using ratios of comparable enterprises we have to assume that comparable companies have similar growth rates, returns on investments, operating margins and are operating in the same region 
 Using such a approach have many limitations 
 Even firms in the same industry can have very different capital structures, risk levels, and growth rates, all of which affect ratios 
 In my opinion, comparison of a company's ratio with industry peers ratios should not be the only factor on which we decide to buy or sell stocks 
 A company could have negative earnings for a lot of reasons 
 The company could just be a bad company and could have had a one time occurrence that just affected the earnings 
 That's why we shouldn't  valuate a company using only ratios 
 DCF method is much better to value companies with negative earnings however is quite complex"
6399,1734,426,4,2018-03-05 16:55:46,"We are making the assumption the companies whose ratios (e.g 
 Price-to-earnings) are properly valued"
5813,2319,160,4,2016-02-29 05:38:03,"Hello everyone 
 This is Shane from Singapore 
 I'm working in the wealth management industry, specifically dealing with risk-return adjusted portfolio asset allocation and investment suitability topics 
 Glad to be enrolled in this course for some revision and refresher of the portfolio management topics"
7001,569,1050,3,2016-03-19 20:02:33,From other lecturers
830,29,375,4,2017-11-04 06:36:50,"Hi Ilya, Great comment 
 I think it may depend on where the stock price data is from 
 For example at  _domain_ :      ""We adjust our historical price data to remove gaps caused by stock splits, dividends, and distributions 
 That may cause our charts to look different from other services that do not perform the same adjustments."""
937,838,80,4,2016-07-18 07:26:01,"""The Growth Rate of Return"" 
  The decrease of the value of money might not happen as expected"
7694,646,336,0,2017-07-27 02:59:42,"2, no double quotation"
6509,3574,149,4,2016-06-21 17:31:07,More worried.\n
6747,2592,56,4,2018-04-23 01:13:43,"That assumption could be that all companies are fairly valued in the industry, that we are comparing the firm we are trying to value to other companies with the same amount of operational risk (that we are not comparing their ratios to that of all of the aggregation of all of the divisions of massive conglomerates which also operate in the area) and that they share similar cash flow growth prospects 
 Though, personally, I have not felt comfortable using the DCF method to value companies as it requires a great deal of forecasting as to the future free cash flows of a particular company and may even prove to be ineffective in the long-run as market conditions may dramatically change between now and the time in which we move out of our investments, a great deal of which we simply cannot predict 
 To quote Third Avenue Chief Investment Officer Curtis Jensen, using the DCF method to value companies is like using the Hubble space telescope 
 When it is moved a fraction of an inch, you view an entirely different galaxy, and it is the same for the DCF method for valuing companies, different assumptions which may only vary slightly have a dramatic effect in determining the fair value of the company 
 Though, using the multiples-based method of valuing companies, one does not encounter such impediments in determining an accurate value of the company and as a result, has a better sense of what the company is worth"
1942,1564,67,4,2018-08-24 12:45:11,I would rather remain on the more risk-averse side and invest 10% of my portfolio in Gold as an insurance
5985,1527,167,4,2016-09-18 09:52:19,"A smaller part of the portfolio invested in gold to act as an insurance in periods of market stress 
 Plus, Investing in gold does not involve any counter-party risk"
